Season,Episode,Title,Air Date,Description,Rating,Image URL,Main Cast
12,23,Delinquent,"Wed, May 11, 2011","After a teenage predator falsely accuses Stabler of sexual assault, Stabler goes on a personal mission to catch him in the act, leading to a shocking discovery about his troubled past.",8.5,"https://m.media-amazon.com/images/M/MV5BMTUxNDM0NDI4Ml5BMl5BanBnXkFtZTcwNjMyMzEzNQ@@._V1_QL75_UX500_CR0,26,500,281_.jpg","['Christopher Meloni', 'Mariska Hargitay', 'Richard Belzer', 'Ice-T', 'BD Wong', 'Tamara Tunie', 'Dann Florek', 'Francie Swift', 'Sterling Beaumon', 'Robert John Burke', 'Ned Eisenberg', 'Isabel Gillies', 'Harvey Atkin', 'Sean Patrick Folster', 'Larry Joshua', 'Lynda Gravatt', 'Caren Browning', 'Rita Wilson']"
12,24,Smoked,"Wed, May 18, 2011","A rape victim is killed right before the trial of her accused rapist, a celebrity hair stylist, begins. However, prosecuting the suspected killer is difficult because he is working as a federal informant.",8.5,"https://m.media-amazon.com/images/M/MV5BNzg1NzI2MjIzM15BMl5BanBnXkFtZTgwNjIzODc3MjE@._V1_QL75_UX500_CR0,47,500,281_.jpg","['Christopher Meloni', 'Mariska Hargitay', 'Richard Belzer', 'Ice-T', 'BD Wong', 'Tamara Tunie', 'Dann Florek', 'Michael Raymond-James', 'Francie Swift', 'Andrew Howard', 'Pedro Pascal', 'Joe Grifasi', 'Hayley McFarland', 'Charlayne Woodard', 'Michael Cullen', 'Al Sapienza', 'James Chen', 'Alice Barrett-Mitchell']"
13,1,Scorched Earth,"Wed, Sep 21, 2011","An African immigrant working as a maid accuses an Italian diplomat of rape, but is she really in it just for the money? Meanwhile, Stabler's return remains in doubt after his latest shooting.",7.6,"https://m.media-amazon.com/images/M/MV5BMjMwNzc2MzIwOF5BMl5BanBnXkFtZTcwMjEzNzc2Ng@@._V1_QL75_UX500_CR0,26,500,281_.jpg","['Mariska Hargitay', 'Danny Pino', 'Kelli Giddish', 'Richard Belzer', 'Ice-T', 'Dann Florek', 'Franco Nero', 'Stephanie March', 'Linus Roache', 'Jenna Stern', 'John Earl Jelks', 'Michael Mastro', 'Kathleen Garrett', 'Tamara Tunie', 'Anika Noni Rose', 'Ron Rifkin', 'Alexander Blaise', 'Ben Van Bergen']"
13,2,Personal Fouls,"Wed, Sep 28, 2011","SVU investigates an accusation that a revered high school basketball coach sexually abused his players, but they ultimately may need the cooperation of a reluctant pro superstar to make the case.",8.3,"https://m.media-amazon.com/images/M/MV5BMjI1MDA3Mjk2OF5BMl5BanBnXkFtZTgwNDQ3OTc3MjE@._V1_QL75_UX500_CR0,47,500,281_.jpg","['Mariska Hargitay', 'Danny Pino', 'Kelli Giddish', 'Richard Belzer', 'Ice-T', 'Dann Florek', 'Stephanie March', 'Dan Lauria', 'Aaron Tveit', 'Mark Blum', 'Tamara Tunie', 'Mehcad Brooks', 'Heavy D', 'Carmelo Anthony', 'Chris Bosh', 'Socorro Santiago', 'Justin Jones', 'Keith Jamal Downing']"
13,3,Blood Brothers,"Wed, Oct 5, 2011",An investigation into a 13-year-old girl's pregnancy leads Detective Olivia Benson to uncover family secrets of a prominent politician.,7.9,"https://m.media-amazon.com/images/M/MV5BMTkxOTI1MTg4OF5BMl5BanBnXkFtZTcwODgxNjc4Ng@@._V1_QL75_UX500_CR0,26,500,281_.jpg","['Mariska Hargitay', 'Danny Pino', 'Kelli Giddish', 'Richard Belzer', 'Ice-T', 'Dann Florek', 'Kyle MacLachlan', 'Diane Neal', 'Anthony Keyvan', 'Piper Curda', 'Marceline Hugot', 'Joey Auzenne', 'Judy Reyes', 'Paige Turco', 'Sara Contreras', 'Desmin Borges', 'Miguel Pinzon', 'Michael Rogers']"
13,4,Double Strands,"Wed, Oct 12, 2011","Detective Rollins believes that SVU has caught a serial rapist from one of her earlier cases in Georgia, but an impassioned request after a suicide attempt leads Amaro to think they may have the wrong person.",8.3,"https://m.media-amazon.com/images/M/MV5BODM1NTc2ODkxMF5BMl5BanBnXkFtZTgwMjI5NTg3MjE@._V1_QL75_UX500_CR0,47,500,281_.jpg","['Mariska Hargitay', 'Danny Pino', 'Kelli Giddish', 'Richard Belzer', 'Ice-T', 'Dann Florek', 'Diane Neal', 'Francie Swift', 'Roxanna Hope Radja', 'Connie Ray', 'Peter McRobbie', 'Karen Young', 'Karen Tsen Lee', 'T.R. Knight', 'Gillian Alexy', 'Makenzie Leigh', 'Azie Tesfai', 'Alex Garfin']"
13,5,Missing Pieces,"Wed, Oct 19, 2011","When a baby of a couple from out of town goes missing, the team tries to find him. But they later turn their focus on the parents, because the story they tell doesn't add up. And they find evidence that leads them to think that the baby died and they brought it to New York to dispose of the body.",7.4,"https://m.media-amazon.com/images/M/MV5BMTYxODA5MTEwMl5BMl5BanBnXkFtZTgwMzgyNjc3MjE@._V1_QL75_UX500_CR0,47,500,281_.jpg","['Mariska Hargitay', 'Danny Pino', 'Kelli Giddish', 'Richard Belzer', 'Ice-T', 'Dann Florek', 'Lisa Joyce', 'Dennis Flanagan', 'Jarlath Conroy', 'Nancy Ticotin', 'Raymond McAnally', 'James Chen', 'Charlie Tahan', 'Diane Neal', 'Tamara Tunie', 'Meredith Holzman', 'Peggy J. Scott', 'Sanjiv Jhaveri']"
13,6,True Believers,"Wed, Nov 2, 2011","A.D.A. Cutter tries to prosecute an African American drug dealer who raped a 19 year old music student, but his opposing counsel is a high-priced attorney who is devoted to protecting the civil rights of accused minorities.",7.8,"https://m.media-amazon.com/images/M/MV5BMjAyNzM2MTEyNl5BMl5BanBnXkFtZTgwNzk0NTg3MjE@._V1_QL75_UX500_CR0,47,500,281_.jpg","['Mariska Hargitay', 'Danny Pino', 'Kelli Giddish', 'Richard Belzer', 'Ice-T', 'Dann Florek', 'Andre Braugher', 'Linus Roache', 'Sofia Vassilieva', 'Cedric Sanders', 'Kevin Geer', 'Rebecca Luker', ""Deirdre O'Connell"", 'Dusty Brown', 'Tabitha Holbert', 'Aisha De Haas', 'Michael Mastro', 'Tamara Tunie']"
13,7,Russian Brides,"Wed, Nov 9, 2011","In order to bring down a Russian mobster running an international prostitution/kidnapping ring disguised as a Russian bride website, Cragen steps from behind the desk to go undercover as a ""john"".",8.3,"https://m.media-amazon.com/images/M/MV5BMTkyMjg4NzY2M15BMl5BanBnXkFtZTcwNTM5MTMwNw@@._V1_QL75_UX500_CR0,26,500,281_.jpg","['Mariska Hargitay', 'Danny Pino', 'Kelli Giddish', 'Richard Belzer', 'Ice-T', 'Dann Florek', 'Stephanie March', 'Timothy Busfield', 'Izabella Miko', 'Ramon Camín', 'Ean Sheehy', 'Michael Kostroff', 'Heidi Schreck', 'Tamara Tunie', 'Anna Orlova', 'Gary Francis Hope', 'Addison LeMay', 'Ananias Dixon']"
13,8,Educated Guess,"Wed, Nov 16, 2011","Benson and Rollins investigate whether a psychiatric patient was raped in her hospital ward, which ultimately leads to a possible predator close to her home.",8.1,"https://m.media-amazon.com/images/M/MV5BM2U3NGE5MTEtYTM4NS00MTRlLThhYzUtMjRiMWZhOWY2OTQwXkEyXkFqcGc@._V1_QL75_UX500_CR0,3,500,281_.jpg","['Mariska Hargitay', 'Danny Pino', 'Kelli Giddish', 'Richard Belzer', 'Ice-T', 'Dann Florek', 'Tim Guinee', 'J. Smith-Cameron', 'Karen Young', 'David Pittu', 'G.K. Umeh', 'David Gelles', 'Michael Chernus', 'Carrie Preston', 'Natasha Lyonne', 'Jennifer McCabe', 'Brit Whittle', 'Kristin Rohde']"
13,9,Lost Traveller,"Wed, Nov 30, 2011","The child of a Romani couple in Brooklyn disappears on his way home from school, but the neighborhood's rom-baro may be interfering with SVU's investigation.",8.2,"https://m.media-amazon.com/images/M/MV5BMjIyMzkxODEzMV5BMl5BanBnXkFtZTcwMTMzOTAxNw@@._V1_QL75_UX500_CR0,26,500,281_.jpg","['Mariska Hargitay', 'Danny Pino', 'Kelli Giddish', 'Richard Belzer', 'Ice-T', 'Dann Florek', 'Stephanie March', 'Linus Roache', 'Donnie Keshawarz', 'Alexandra Silber', 'Michael Barra', 'Scott William Winters', 'Gavin Lee', 'Gilbert Gottfried', 'Quinn Shephard', 'Lili Reinhart', 'Tamara Tunie', 'Mark Margolis']"
13,10,Spiraling Down,"Wed, Dec 7, 2011","A retired pro quarterback is busted for having sex with a 14-year-old prostitute, but he may be suffering from diminished capacity because of all the concussions he had on the field.",8.6,"https://m.media-amazon.com/images/M/MV5BNjQ2MjIzMTExOF5BMl5BanBnXkFtZTgwMjU2Mjg3MjE@._V1_QL75_UX500_CR0,47,500,281_.jpg","['Mariska Hargitay', 'Danny Pino', 'Kelli Giddish', 'Richard Belzer', 'Ice-T', 'Dann Florek', 'Andre Braugher', 'Stephanie March', 'Kay Panabaker', 'Jon Michael Hill', 'Dominic Fumusa', 'Robin Paul', 'Beth Chamberlin', 'Laura Benanti', 'Ned Eisenberg', 'Tonye Patano', 'Linda Emond', 'David Pittu']"
13,11,Theatre Tricks,"Wed, Jan 11, 2012",SVU tries to figure out who was responsible for the real-life rape of an actress during an interactive theater performance that everybody just assumed was part of the show.,7.9,"https://m.media-amazon.com/images/M/MV5BMTQzNDkxNTY0Ml5BMl5BanBnXkFtZTgwMjcxMzg3MjE@._V1_QL75_UX500_CR0,47,500,281_.jpg","['Mariska Hargitay', 'Danny Pino', 'Kelli Giddish', 'Richard Belzer', 'Ice-T', 'Dann Florek', 'Stephanie March', 'Jenn Proske', 'Grant Shaud', 'Gayle Rankin', 'Gilbert Gottfried', 'Adam Driver', 'Angela Pietropinto', 'Jacqueline Hendy', 'Fisher Stevens', 'Kevin Pollak', 'Coco Austin', 'Larissa Bond']"
13,12,Official Story,"Wed, Jan 18, 2012","SVU investigates an accusation of a brutal rape in Iraq involving a private defense contractor, and Olivia takes a romantic interest in the ADA who is prosecuting the case.",8.2,"https://m.media-amazon.com/images/M/MV5BMTcxOTQzMDU1MV5BMl5BanBnXkFtZTcwOTIzNzgyNw@@._V1_QL75_UX500_CR0,26,500,281_.jpg","['Mariska Hargitay', 'Danny Pino', 'Kelli Giddish', 'Richard Belzer', 'Ice-T', 'Dann Florek', 'Harry Connick Jr.', 'Holt McCallany', 'Lola Glaudini', 'Laura Benanti', 'Billy Brown', 'Craig Walker', 'Megan Ketch', 'Annie Meisels', 'John Doman', 'Caris Vujcec', 'Jacob Wallach', 'Dana Vance']"
13,13,Father's Shadow,"Wed, Feb 8, 2012","A 19-year-old creates a hostage situation after his father is accused of sexual assault, and Olivia uses her personal experience to help defuse the situation.",7.8,"https://m.media-amazon.com/images/M/MV5BMjAwODg3MTk4MV5BMl5BanBnXkFtZTgwNDgwMDg3MjE@._V1_QL75_UX500_CR0,47,500,281_.jpg","['Mariska Hargitay', 'Danny Pino', 'Kelli Giddish', 'Richard Belzer', 'Ice-T', 'Dann Florek', 'Harry Connick Jr.', 'Linus Roache', 'Cameron Monaghan', 'Kelly Karbacz', 'David Warshofsky', 'Chris Butler', 'Robert Klein', 'Miranda Lambert', 'Michael Mastro', 'Ilene Kristen', 'Karen Tsen Lee', 'Michael McKean']"
13,14,Home Invasions,"Wed, Feb 15, 2012","After a couple is murdered in their home and their daughter is critically injured, SVU uncovers a number of twisted family secrets, as well as detective Rollins' gambling addiction.",8.0,"https://m.media-amazon.com/images/M/MV5BMjI4NzAzOTYxMV5BMl5BanBnXkFtZTgwNTY2MTg3MjE@._V1_QL75_UX500_CR0,47,500,281_.jpg","['Mariska Hargitay', 'Danny Pino', 'Kelli Giddish', 'Richard Belzer', 'Ice-T', 'Dann Florek', 'Jake T. Austin', 'Elizabeth Rodriguez', 'Lauren Kelly', 'Danny Mastrogiorgio', 'Delaney Williams', 'Alan Davidson', 'Isiah Whitlock Jr.', 'Cady Huffman', 'Betsy Aidem', 'Esai Morales', 'Tommy Flanagan', 'Alex Manette']"
13,15,Hunting Ground,"Wed, Feb 22, 2012","An underage escort is reported missing, and SVU soon discovers that they are dealing with a serial killer who may be playing games with his victims.",8.2,"https://m.media-amazon.com/images/M/MV5BMTc1OTM3OTE2OV5BMl5BanBnXkFtZTgwNzk0ODc3MjE@._V1_QL75_UX500_CR0,47,500,281_.jpg","['Mariska Hargitay', 'Danny Pino', 'Kelli Giddish', 'Richard Belzer', 'Ice-T', 'Dann Florek', 'Harry Connick Jr.', 'Fred Arsenault', 'Emily Kinney', 'Reyna de Courcy', 'Josh Mostel', 'Laura Benanti', 'Alison Bartlett', 'Walter Belenky', 'Stephanie Pope', 'Tamara Tunie', 'Maryann Urbano', 'Jimmy Palumbo']"
13,16,Child's Welfare,"Wed, Feb 29, 2012","While Olivia tries to help her brother regain custody of his two children, SVU discovers that a baby abandoned in front of a church belongs to a missing teen.",7.8,"https://m.media-amazon.com/images/M/MV5BMzk5MDc1OTAxOV5BMl5BanBnXkFtZTgwMzk0ODc3MjE@._V1_QL75_UX500_CR0,47,500,281_.jpg","['Mariska Hargitay', 'Danny Pino', 'Kelli Giddish', 'Richard Belzer', 'Ice-T', 'Dann Florek', 'Andre Braugher', 'Nicole Beharie', 'Veanne Cox', 'Priscilla Lopez', 'Halley Wegryn Gross', 'Peter Van Wagner', 'Ami Brabson', 'Kevin Kane', 'Tabitha Holbert', 'Julie Lauren', 'Glenn Kalison', 'Michael Weston']"
13,17,Justice Denied,"Wed, Apr 11, 2012",Benson's relationship with ADA Hayden threatens to be exposed after she discovers that she helped put the wrong man in prison eight years earlier for rape.,8.1,"https://m.media-amazon.com/images/M/MV5BMTkxMzQ1MTUyOV5BMl5BanBnXkFtZTgwNTg5MTg3MjE@._V1_QL75_UX500_CR0,47,500,281_.jpg","['Mariska Hargitay', 'Danny Pino', 'Kelli Giddish', 'Richard Belzer', 'Ice-T', 'Dann Florek', 'Andre Braugher', 'Harry Connick Jr.', 'Guillermo Diaz', 'Mark Consuelos', 'Cynthia LaForte', 'David Harris', 'Ramon Fernandez', 'Ami Brabson', 'Tabitha Holbert', 'Max Baker', 'Samantha Soule', 'Alexander M. Cole']"
13,18,Valentine's Day,"Wed, Apr 18, 2012",A rape investigation is set into motion after a husband sees his wife being attacked while video chatting.,7.6,"https://m.media-amazon.com/images/M/MV5BMTU5OTQzNzUzMF5BMl5BanBnXkFtZTgwOTg5MTg3MjE@._V1_QL75_UX500_CR0,47,500,281_.jpg","['Mariska Hargitay', 'Danny Pino', 'Kelli Giddish', 'Richard Belzer', 'Ice-T', 'Dann Florek', 'Diane Neal', 'Chloë Sevigny', 'Laura Benanti', 'Josh Randall', 'Jenna Stern', 'Laurie Kennedy', 'Shawn Hatosy', 'Rich Sommer', 'Ron Rifkin', 'Carsey Walker Jr.', 'Angel Pai', 'Johnny Solo']"
13,19,Street Revenge,"Wed, Apr 25, 2012","The task of find a serial rapist becomes more difficult when a team of neighborhood vigilante ""superheroes"" starts trying to avenge the crimes.",7.3,"https://m.media-amazon.com/images/M/MV5BNDUxMjUwNTcwOV5BMl5BanBnXkFtZTgwOTE2MDg3MjE@._V1_QL75_UX500_CR0,47,500,281_.jpg","['Mariska Hargitay', 'Danny Pino', 'Kelli Giddish', 'Richard Belzer', 'Ice-T', 'Dann Florek', 'Michael Rispoli', 'Hani Furstenberg', ""Keir O'Donnell"", 'Laura Benanti', 'Gavin Lee', 'Dominic Fumusa', 'Veronika Dominczyk', 'David Pittu', 'Koa Lang', 'Lacretta', 'J. Paul Nicholas', 'Lia Yang']"
13,20,Father Dearest,"Wed, May 2, 2012","Is a sperm donor father trying to have babies with the children he fathered, or could it be part of an even more fiendish plot?",7.7,"https://m.media-amazon.com/images/M/MV5BMjMyMzU3MzU4MF5BMl5BanBnXkFtZTgwNjYxNDg3MjE@._V1_QL75_UX500_CR0,47,500,281_.jpg","['Mariska Hargitay', 'Danny Pino', 'Kelli Giddish', 'Richard Belzer', 'Ice-T', 'Dann Florek', 'Eric Close', 'BD Wong', 'Nikki M. James', 'Clarke Thorell', 'Tina Benko', 'Ryann Shane', 'Shannon Walsh', 'Kathryn Rossetter', 'Gretchen Egolf', 'James Van Der Beek', 'Sonya Walger', 'Sara Hogrefe']"
13,21,Learning Curve,"Wed, May 9, 2012","As Fin tries to get justice after his gay son's fiancé is brutally beaten in a hate crime, SVU uncovers a scandal involving a teacher sexually abusing a student at a prep school.",7.8,"https://m.media-amazon.com/images/M/MV5BMzE2ODk2MTA2N15BMl5BanBnXkFtZTgwMTA1MTg3MjE@._V1_QL75_UX500_CR0,47,500,281_.jpg","['Mariska Hargitay', 'Danny Pino', 'Kelli Giddish', 'Richard Belzer', 'Ice-T', 'Dann Florek', 'Stephanie March', 'Tony Hale', 'Betty Gilpin', 'Dylan Minnette', 'Ernest Waddell', 'Migs Govea', 'Justin Gregory Lopez', 'Olivia Ford', 'Jacqueline Hendy', 'Lenny Venito', 'Jane Adams', 'Martha Stewart']"
13,22,Strange Beauty,"Wed, May 16, 2012",The investigation of the homicide of a young woman who recently had her leg amputated sends SVU into the strange culture of body modification.,7.7,"https://m.media-amazon.com/images/M/MV5BODM2MDAzOTc1Nl5BMl5BanBnXkFtZTgwNjk5NTg3MjE@._V1_QL75_UX500_CR0,47,500,281_.jpg","['Mariska Hargitay', 'Danny Pino', 'Kelli Giddish', 'Richard Belzer', 'Ice-T', 'Dann Florek', 'David Eigenberg', 'Patrick Fischler', 'Britt Lower', 'Myk Watford', 'Bridget Barkan', 'Ilana Levine', 'Tony Campisi', 'Constantine Maroulis', 'Tamara Tunie', 'Morgan Lynch', 'Paul Whitty', 'Ralph Lucarelli']"
13,23,Rhodium Nights,"Wed, May 23, 2012",The murder of a prostitute at a bachelor party sends SVU on a dangerous investigation that could lead all the way into the highest reaches of New York power and influence.,8.5,"https://m.media-amazon.com/images/M/MV5BNzUxMjcwMzEyMV5BMl5BanBnXkFtZTgwNjA3NDg3MjE@._V1_QL75_UX500_CR0,47,500,281_.jpg","['Mariska Hargitay', 'Danny Pino', 'Kelli Giddish', 'Richard Belzer', 'Ice-T', 'Dann Florek', 'Dean Winters', 'Pippa Black', 'Brooke Smith', 'Peter Jacobson', 'Tamara Tunie', 'Eric Ladin', 'Ron Rifkin', 'Laura Benanti', 'Matt Burns', 'Reg E. Cathey', 'Amy Hargreaves', 'Tabitha Holbert']"
14,1,Lost Reputation,"Wed, Sep 26, 2012","After Cragen is accused of murder, the team works secretly around the clock to defend him. Meanwhile, when Amaro also becomes implicated in the scandal and his personal life falls apart, he refuses to go down quietly.",8.6,"https://m.media-amazon.com/images/M/MV5BMTgwMjQxMDI3OV5BMl5BanBnXkFtZTcwMzExMDM1OA@@._V1_QL75_UX500_CR0,26,500,281_.jpg","['Mariska Hargitay', 'Danny Pino', 'Kelli Giddish', 'Richard Belzer', 'Ice-T', 'Dann Florek', 'Dean Winters', 'Paget Brewster', 'Peter Jacobson', 'Brooke Smith', 'Reg E. Cathey', 'Pippa Black', 'Ron Rifkin', 'Laura Benanti', 'Jason Cerbone', 'Amy Hargreaves', 'Michael Mastro', 'Tamara Tunie']"
14,2,Above Suspicion,"Wed, Sep 26, 2012","As the prostitution scandal continues to grow, key witnesses against the alleged madam begin to die under mysterious circumstances, and undercover agent Cassidy becomes a victim of friendly fire.",8.6,"https://m.media-amazon.com/images/M/MV5BYWVhNGQ2NGQtZTZiNi00MzVmLTg0OWQtMTNjMGIwMTk1MDIwXkEyXkFqcGc@._V1_QL75_UX500_CR0,109,500,281_.jpg","['Mariska Hargitay', 'Danny Pino', 'Kelli Giddish', 'Richard Belzer', 'Ice-T', 'Dann Florek', 'Dean Winters', 'Paget Brewster', 'Peter Jacobson', 'Brooke Smith', 'Reg E. Cathey', 'Michael Potts', 'Sharon Washington', 'Courtney Reed', 'Adam Baldwin', 'Sue Simmons', 'Stephen C. Bradbury', 'Marc John Jefferies']"
14,3,Twenty-Five Acts,"Wed, Oct 10, 2012","An erotic novelist is sexually assaulted by a popular TV-show host who attempts to bring her book to life. The SVU detectives persuade her to press charges, but the investigation reveals a secret that could ruin the novelist's career and her case.",8.2,"https://m.media-amazon.com/images/M/MV5BMjMzOTIwMDEzNl5BMl5BanBnXkFtZTgwMjY0OTc3MjE@._V1_QL75_UX500_CR0,47,500,281_.jpg","['Mariska Hargitay', 'Danny Pino', 'Kelli Giddish', 'Richard Belzer', 'Ice-T', 'Dann Florek', 'Roger Bart', 'Anna Chlumsky', 'Elizabeth Marvel', 'Romy Rosemont', 'Tonye Patano', 'Peter McRobbie', ""Rory O'Malley"", 'Raúl Esparza', 'Adam Baldwin', 'Steve Rosen', 'Hallie Cooper-Novack', 'Lucia Spina']"
14,4,Acceptable Loss,"Wed, Oct 17, 2012",SVU is forced to work with Homeland Security--represented by former Major Case detective Eames--when a sex slave ring it is investigating is discovered to have ties to terrorism.,7.9,"https://m.media-amazon.com/images/M/MV5BNDA0Mjg2OTk1N15BMl5BanBnXkFtZTgwMTA4Nzg3MjE@._V1_QL75_UX500_CR0,47,500,281_.jpg","['Mariska Hargitay', 'Danny Pino', 'Kelli Giddish', 'Richard Belzer', 'Ice-T', 'Dann Florek', 'Richard Kind', 'Doug E. Doug', 'Alon Aboutboul', 'Joey Oglesby', 'Angela Sarafyan', 'Karen Tsen Lee', 'Kathryn Erbe', 'Evgeniya Radilova', 'Jamila Velazquez', 'Derrick Baskin', 'Shezi Sardar', 'Jack Haley']"
14,5,Manhattan Vigil,"Wed, Oct 24, 2012","A child abduction case brings back haunting memories of 13 year old cold case from the same neighborhood, and the two cases may turn out to be related.",8.1,"https://m.media-amazon.com/images/M/MV5BMTgyNDI0OTc3OV5BMl5BanBnXkFtZTgwNDE5OTc3MjE@._V1_QL75_UX500_CR0,47,500,281_.jpg","['Mariska Hargitay', 'Danny Pino', 'Kelli Giddish', 'Richard Belzer', 'Ice-T', 'Dann Florek', 'Hamish Linklater', 'Mili Avital', 'Alex Karpovsky', 'Liza Colón-Zayas', 'Tom Sizemore', 'Madison McKinley', 'Chris Orbach', 'Jenna Wolfe', 'Ramsey Faragallah', 'Sue Kim', 'Gordana Rashovich', 'Luke Fava']"
14,6,Friending Emily,"Wed, Oct 31, 2012","While Amanda's troubled sister comes for a surprise visit, the team searches for a 14 year old girl who was abducted at a frat party.",7.9,"https://m.media-amazon.com/images/M/MV5BMTczMjA5NDI4Nl5BMl5BanBnXkFtZTgwNTYxNzg3MjE@._V1_QL75_UX500_CR0,47,500,281_.jpg","['Mariska Hargitay', 'Danny Pino', 'Kelli Giddish', 'Richard Belzer', 'Ice-T', 'Dann Florek', 'Chris Coy', 'Lindsay Pulsipher', 'Izzie Steele', 'Taylor Spreitler', 'Neal Matarazzo', 'Kathy McCafferty', 'Catherine Missal', 'Frank Deal', 'David Deblinger', 'Ean Sheehy', 'Raúl Esparza', 'Jay Devore']"
14,7,Vanity's Bonfire,"Wed, Nov 14, 2012","A baby kidnapped from a playground leads to a twisted case of lies, betrayal, and infidelity.",7.6,"https://m.media-amazon.com/images/M/MV5BMjAxNjcwNzc2NF5BMl5BanBnXkFtZTgwOTY3MDg3MjE@._V1_QL75_UX500_CR0,47,500,281_.jpg","['Mariska Hargitay', 'Danny Pino', 'Kelli Giddish', 'Richard Belzer', 'Ice-T', 'Dann Florek', 'Scott Bakula', 'Jessica Hecht', 'Bijou Phillips', 'Luke Kirby', 'Liza J. Bennett', 'Priscilla Lopez', 'David Pittu', 'Ami Brabson', 'Abby Quinn', 'Tamara Tunie', 'John-Patrick Driscoll', 'Rosal Colon']"
14,8,Lessons Learned,"Wed, Nov 21, 2012",A retired English teacher's suicide sheds light on a long-secret sex abuse scandal at a prestigious boy's prep school.,8.0,"https://m.media-amazon.com/images/M/MV5BMTkwMTUxNTMyN15BMl5BanBnXkFtZTgwNzA0NDc3MjE@._V1_QL75_UX500_CR0,47,500,281_.jpg","['Mariska Hargitay', 'Danny Pino', 'Kelli Giddish', 'Richard Belzer', 'Ice-T', 'Dann Florek', 'Charles Grodin', 'Anthony Rapp', 'Elizabeth Marvel', 'Frank Wood', 'Mason Pettit', 'Jeremy Bobb', 'Buck Henry', 'Alvin Epstein', 'Jayce Bartok', 'Robert Sella', 'Marc Webster', 'Tijuana Ricks']"
14,9,Dreams Deferred,"Wed, Dec 5, 2012","The SVU needs the help of an abused, older prostitute to catch one of her Johns who is on a killing spree, but can they also help her get out of her chosen life, and save her family?",8.9,"https://m.media-amazon.com/images/M/MV5BMTg2MzMwNjU1MV5BMl5BanBnXkFtZTgwNTkzMTg3MjE@._V1_QL75_UX500_CR0,47,500,281_.jpg","['Mariska Hargitay', 'Danny Pino', 'Kelli Giddish', 'Richard Belzer', 'Ice-T', 'Dann Florek', 'Patricia Arquette', 'P.J. Brown', 'Amanda Quaid', 'Gbenga Akinnagbe', 'Bridget Barkan', 'Kenneth Franklin', 'Anne Meara', 'Jason Gedrick', 'Jasmine Carmichael', 'Tyson Hall', 'Kendrick Alan Reinsch', 'Emil Benjamin']"
14,10,Presumed Guilty,"Wed, Jan 2, 2013","The beating of a priest exposes a secret long hidden by the Church, but is the wrong man in prison for the crime?",8.0,"https://m.media-amazon.com/images/M/MV5BMTczMzQ0MDUyM15BMl5BanBnXkFtZTgwMzcyOTc3MjE@._V1_QL75_UX500_CR0,47,500,281_.jpg","['Mariska Hargitay', 'Danny Pino', 'Kelli Giddish', 'Richard Belzer', 'Ice-T', 'Dann Florek', ""Denis O'Hare"", 'Erik LaRay Harvey', 'Melissa Marsala', 'Peter Gerety', 'Victor Cruz', 'Nathan Lee Graham', 'Daniel Raymont', 'Tamara Tunie', 'Theo Rossi', 'LisaGay Hamilton', 'Tony Plana', 'Gizel Jiménez']"
14,11,Beautiful Frame,"Wed, Jan 9, 2013","The SVU clashes with the Suffolk County DA, who is prosecuting a recent rape victim for murder .The story fails to add up when the accuser appears to be connected to the crime.",7.8,"https://m.media-amazon.com/images/M/MV5BMTQ3NDQ5NTc4OF5BMl5BanBnXkFtZTgwMzYwODc3MjE@._V1_QL75_UX500_CR0,47,500,281_.jpg","['Mariska Hargitay', 'Danny Pino', 'Kelli Giddish', 'Richard Belzer', 'Ice-T', 'Dann Florek', 'Jane Kaczmarek', 'Yvonne Zima', 'Renée Elise Goldsberry', 'Shamika Cotton', 'Todd Gearhart', 'Craig muMs Grant', 'Robert LuPone', 'Aida Turturro', 'Dan Debenport', 'Tony Campisi', 'Enver Gjokaj', 'Raúl Esparza']"
14,12,Criminal Hatred,"Wed, Jan 30, 2013",SVU and the DA's office struggle with finding the right strategy in a case dealing with a gay man who is picking up and then attacking closeted gay married men.,8.0,"https://m.media-amazon.com/images/M/MV5BMzIxMzI3NTAxOV5BMl5BanBnXkFtZTgwNDcyNzEyOTE@._V1_QL75_UX500_CR0,47,500,281_.jpg","['Mariska Hargitay', 'Danny Pino', 'Kelli Giddish', 'Richard Belzer', 'Ice-T', 'Dann Florek', 'Nia Vardalos', 'Paul Fitzgerald', 'Victoria Rowell', 'Max Carpenter', 'Jenny Bacon', 'Annika Boras', 'Wass Stevens', 'Raúl Esparza', 'Fred Norris', 'Andres Quintero', 'Jeff Talbott', 'James Lloyd Reynolds']"
14,13,Monster's Legacy,"Wed, Feb 6, 2013",Benson and attorney Bayard Ellis help a death row inmate in Ohio whose history as a sex abuse victim may have been ignored by his defense attorney.,8.6,"https://m.media-amazon.com/images/M/MV5BMTk0OTg2ODEwNl5BMl5BanBnXkFtZTgwNTgwMjg3MjE@._V1_QL75_UX500_CR0,47,500,281_.jpg","['Mariska Hargitay', 'Danny Pino', 'Kelli Giddish', 'Richard Belzer', 'Ice-T', 'Dann Florek', 'Andre Braugher', 'Enid Graham', 'Peter Scanavino', 'Jack Dimich', 'Carmen Roman', 'Elaine Hyman', 'Eve Plumb', 'Chris Sullivan', 'Edward Asner', 'Mike Tyson', 'Daria Hardeman', 'Alok Tewari']"
14,14,Secrets Exhumed,"Wed, Feb 13, 2013",SVU becomes suspicious when FBI agent Dana Lewis aggressively tries to get a serial rapist confess to a murder that he steadfastly denies having committed.,8.1,"https://m.media-amazon.com/images/M/MV5BNjg2OTQ2MjIzM15BMl5BanBnXkFtZTgwNTc2Njc3MjE@._V1_QL75_UX500_CR0,47,500,281_.jpg","['Mariska Hargitay', 'Danny Pino', 'Kelli Giddish', 'Richard Belzer', 'Ice-T', 'Dann Florek', 'Marcia Gay Harden', 'Roscoe Orman', 'John Ottavino', 'Opal Alladin', 'Jay Karnes', 'Harold Perrineau', ""Kathleen O'Neill"", 'Sue Kim', 'Danny Bolero', 'Jena Mroz']"
14,15,Deadly Ambition,"Wed, Feb 20, 2013","After Amanda kills the father of her pregnant sister's child after what she believes is an attack, SVU discovers that Amanda was just a pawn in the sister's sinister plot to get rid of him and become rich.",8.1,"https://m.media-amazon.com/images/M/MV5BMTU1NjcyMzUxMl5BMl5BanBnXkFtZTgwODY2Nzc3MjE@._V1_QL75_UX500_CR0,47,500,281_.jpg","['Mariska Hargitay', 'Danny Pino', 'Kelli Giddish', 'Richard Belzer', 'Ice-T', 'Dann Florek', 'Lindsay Pulsipher', 'Robert John Burke', 'Joe Grifasi', 'Isiah Whitlock Jr.', 'Mary B. McCann', 'Jayne Houdyshell', 'Michael Mastro', 'Rafael Sardina', 'Carolyn McCormick', 'Theis Weckesser', 'Joel Brady', 'Gabrielle Ruiz']"
