Season,Episode,Title,Air Date,Description,Rating,Image URL,Main Cast
17,23,Heartfelt Passages,"Wed, May 25, 2016","The case against corrections officer Gary Munson continues, Barba continues to receive death threats, and Dodds winds up in a hostage situation with the accused in Munson's home.",9.0,"https://m.media-amazon.com/images/M/MV5BZDgyY2Q3MGYtYzQ2ZC00Yjg0LTk5OTMtMjhhZTRjN2QzOGJiXkEyXkFqcGc@._V1_QL75_UX500_CR0,47,500,281_.jpg","['Mariska Hargitay', 'Kelli Giddish', 'Ice-T', 'Peter Scanavino', 'Raúl Esparza', 'Andy Karl', 'Jack McGee', 'Karina Logue', 'Robert John Burke', 'Bill Duke', 'Ramón Franco', ""Kevin O'Rourke"", 'Bill Irwin', 'Brad Garrett', 'Peter Gallagher', 'Kathryn Rossetter', 'Stephen C. Bradbury', 'Rebecca Brinkley']"
18,1,Terrorized,"Wed, Sep 21, 2016","While identifying a young boy left alone in Central Park, SVU uncovers a possible terrorist plot that leads to several casualties. The DA needs a slam-dunk conviction, but the defendant's history as an abuse victim complicates matters.",7.8,"https://m.media-amazon.com/images/M/MV5BMTc0NDA5Mzg1N15BMl5BanBnXkFtZTgwODE0NzAxMDI@._V1_QL75_UX500_CR0,47,500,281_.jpg","['Mariska Hargitay', 'Kelli Giddish', 'Ice-T', 'Peter Scanavino', 'Raúl Esparza', 'Elizabeth Marvel', 'Robert John Burke', 'Marc Damon Johnson', 'Tarek Bishara', 'Yvonna Kopacz Wright', 'Natia Dune', 'Sharon Washington', 'Max von Essen', 'Robert C. Kirk', 'Peter Gallagher', 'Taso Mikroulis', 'Joel Brady', 'Mark Jacoby']"
18,2,Making a Rapist,"Wed, Sep 28, 2016","A man convicted of rape is exonerated and released 16 years later. However, on the night of his release, the daughter of the woman he was convicted of raping is also raped and murdered, and he is SVU's prime suspect.",7.7,"https://m.media-amazon.com/images/M/MV5BMzg4MDI0NDAyOF5BMl5BanBnXkFtZTgwNjYxMTUxMDI@._V1_QL75_UX500_CR0,26,500,281_.jpg","['Mariska Hargitay', 'Kelli Giddish', 'Ice-T', 'Peter Scanavino', 'Raúl Esparza', 'Kelli Williams', 'Delaney Williams', 'Cody Kostro', 'Jenna Stern', 'Henry Thomas', 'Alok Tewari', 'Ryan Jonze', 'David Spadora', 'Alexis Collins', 'Meredith Handerhan', 'Haskiri Velazquez', 'Erica Camarano', 'Sarah Malone']"
18,3,Imposter,"Wed, Oct 5, 2016","SVU chooses to pursue a risky ""rape by fraud"" case involving a con artist who poses as a college admissions director to have sex with the mothers of prospective students.",6.7,"https://m.media-amazon.com/images/M/MV5BOTk3MzU4NjY1Ml5BMl5BanBnXkFtZTgwMDU4MjMyMDI@._V1_QL75_UX500_CR0,26,500,281_.jpg","['Mariska Hargitay', 'Kelli Giddish', 'Ice-T', 'Peter Scanavino', 'Raúl Esparza', 'Paula Marshall', 'Vincent Curatola', 'Chris Henry Coffey', 'Steve Rosen', 'Callie Thorne', 'Wallace Langham', 'Conor Proft', 'Andre B. Blake', 'Mac Brydon', 'Paul DeBoy', 'Tiffan Borelli', 'Juney Smith', 'Julia Verón']"
18,4,Heightened Emotions,"Wed, Oct 12, 2016","An aspiring Olympic athlete claims she is a rape victim, but the publicity surrounding the case could threaten her Olympic future, and reveal some shocking details about her sordid personal life.",6.9,"https://m.media-amazon.com/images/M/MV5BMjIzMjczNDY5N15BMl5BanBnXkFtZTgwMDYyODAzMDI@._V1_QL75_UX500_CR0,26,500,281_.jpg","['Mariska Hargitay', 'Kelli Giddish', 'Ice-T', 'Peter Scanavino', 'Raúl Esparza', 'Brit Morgan', 'David Alpay', 'Lindsay Pulsipher', 'Theo Stockman', 'Hari Dhillon', 'Jason Babinsky', 'Jordan Baker', 'Ami Brabson', 'Caleb Eberhardt', 'Kati Sharp', 'Shea Glaser', 'Natasha Murray', 'Jane Fergus']"
18,5,Rape Interrupted,"Wed, Oct 26, 2016","Olivia discovers that a young man facing rape charges is the son of her first police partner, who comes to her asking to cash in on an a favor that she owes him.",7.4,"https://m.media-amazon.com/images/M/MV5BMTY1NzAxMzQ5M15BMl5BanBnXkFtZTgwMjg0NzI0MDI@._V1_QL75_UX500_CR0,26,500,281_.jpg","['Mariska Hargitay', 'Kelli Giddish', 'Ice-T', 'Peter Scanavino', 'Raúl Esparza', 'Anthony Edwards', 'Corey Cott', 'Anna Osceola', 'Joseph Lyle Taylor', 'Kelly McAndrew', 'Jillian Mueller', 'Cindy Cheung', 'Jenna Stern', 'RJ Brown', 'Liam Lane', 'Rachel Bles', 'Katie McCarty', 'Gabriel Ellis']"
18,6,Broken Rhymes,"Wed, Nov 9, 2016","A rising hip-hop star is a suspect in a brutal transgender beating, but his alibi might be as shocking as the crime itself.",7.5,"https://m.media-amazon.com/images/M/MV5BY2I4ZWMyMWQtM2IyNy00Y2JiLTkyMDctOTA2Y2EwMDhmOTk0XkEyXkFqcGc@._V1_QL75_UX500_CR0,47,500,281_.jpg","['Mariska Hargitay', 'Kelli Giddish', 'Ice-T', 'Peter Scanavino', 'Raúl Esparza', 'Mitchell Edwards', 'Okieriete Onaodowan', 'Will Swenson', 'Rodney Richardson', 'Jay Klaitz', 'Wyclef Jean', 'Sabel Gonzales', 'Jacqueline Torres', 'C. David Johnson', 'Ngozi Jane Anyanwu', 'Sonia Manzano', 'Alet Taylor', 'Ruby Taylor']"
18,7,Next Chapter,"Wed, Jan 4, 2017","A woman is sexually assaulted by a masked man, but she believes the rapist is the same man who went to jail for stalking her. Meanwhile, Tucker contemplates retirement and a future with Benson.",7.7,"https://m.media-amazon.com/images/M/MV5BYzg0OGU3ZGMtZWFkYy00ZmI5LWFiYmItNjI1ZGJjZGVjNzNhXkEyXkFqcGc@._V1_QL75_UX500_CR0,26,500,281_.jpg","['Mariska Hargitay', 'Kelli Giddish', 'Ice-T', 'Peter Scanavino', 'Raúl Esparza', 'Chris Bauer', 'Annie Monroe', 'Zach Appelman', 'Robert John Burke', 'Enid Graham', 'Ben Cole', 'Bret Lada', ""Shaun O'Hagan"", 'Lee Garrett', 'Nathan Chang', 'Emma Ramos', 'Manini Gupta', 'Reginald L. Barnes']"
18,8,Chasing Theo,"Wed, Jan 11, 2017","SVU is on the lookout for a missing 6-year-old boy, but also discovers that the victim has a very dysfunctional home life and that the kidnappers may have actually had the boy's best interests in mind.",7.6,"https://m.media-amazon.com/images/M/MV5BNzk1MTE0NzEtY2RhYy00ODdmLWFjNTQtMDNmNzM5Y2FkYjA0XkEyXkFqcGc@._V1_QL75_UX500_CR0,26,500,281_.jpg","['Mariska Hargitay', 'Kelli Giddish', 'Ice-T', 'Peter Scanavino', 'Raúl Esparza', 'Rachelle Lefevre', 'Zoe McLellan', 'Robert John Burke', 'Adriana Ducassi', 'Sebastian Beacon', 'Iain Armitage', 'Rafael Benoit', 'Bjorn Thorstad', 'Nat Cassidy', 'Erica Camarano', 'Mina Joo', 'Timbrooke Ford Filbert', 'Dorian Cobb']"
18,9,Decline and Fall,"Wed, Jan 18, 2017","A bartender says she was raped after a birthday party for a notorious philandering businessman. The man's grandson soon claims that he had consensual sex with the woman, but the investigation later reveals a second familial match.",8.0,"https://m.media-amazon.com/images/M/MV5BZjY4MmQwNWEtNmM4Yy00NTk3LTk4NGMtNDJiNmNlNzViNTM0XkEyXkFqcGc@._V1_QL75_UX500_CR0,26,500,281_.jpg","['Mariska Hargitay', 'Kelli Giddish', 'Ice-T', 'Peter Scanavino', 'Raúl Esparza', 'Jim True-Frost', 'Raphael Sbarge', 'Ariane Rinehart', 'Ian Nelson', 'Jackie Debatin', 'Kathryn Kates', 'Andrea Burns', 'Sarah Clarke', 'Bob Gunton', 'Helmar Augustus Cooper', 'Gail Bennett', 'Annika Pergament', 'Gabriella Dileo']"
18,10,Motherly Love,"Wed, Feb 8, 2017","A teenage boy uses a rifle to save his mother from her attacker, only to learn the target was someone he knows.",8.5,"https://m.media-amazon.com/images/M/MV5BNjhlY2Y0OWUtNzhlYy00NWU2LWEwOTItZjc1MDY5NmQwZGIxXkEyXkFqcGc@._V1_QL75_UX500_CR0,26,500,281_.jpg","['Mariska Hargitay', 'Kelli Giddish', 'Ice-T', 'Peter Scanavino', 'Raúl Esparza', 'Sarah Wynter', 'Delaney Williams', 'Daniel Cosgrove', 'Aaron Sanders', 'Jason Bowen', 'Jenna Stern', 'Benton Greene', 'Chantal Jean-Pierre', 'Patrick Boll', 'Gage Banister', 'Deirdre Madigan', 'Donald Dash', 'Lauren Noble']"
18,11,Great Expectations,"Wed, Feb 15, 2017",SVU investigates the players of a youth hockey league after a locker room hazing incident.,8.3,"https://m.media-amazon.com/images/M/MV5BMjZmZDYzZGMtODRmOC00MWQ1LWJiNWUtOGJhMzVhMmQ5YmI4XkEyXkFqcGc@._V1_QL75_UX500_CR0,26,500,281_.jpg","['Mariska Hargitay', 'Kelli Giddish', 'Ice-T', 'Peter Scanavino', 'Raúl Esparza', 'Brent Sexton', 'Gia Crovatin', 'Amy Spanger', 'Brian Hutchison', 'Erika Rolfsrud', 'Lincoln Melcher', 'Christopher Paul Richards', 'Ben Cook', 'Olga Merediz', 'Taylor Anthony Miller', 'Drew Beasley', 'Elijah Richardson', 'Josh Banks']"
18,12,No Surrender,"Wed, Feb 22, 2017",Fin returns to his military roots when a fellow Army ranger attempts to recover from a sexual assault.,7.0,"https://m.media-amazon.com/images/M/MV5BYmE2Yjc0MDUtYzNkZS00NzYxLTkxMTEtYTJmOWVlYWNhYjVkXkEyXkFqcGc@._V1_QL75_UX500_CR0,26,500,281_.jpg","['Mariska Hargitay', 'Kelli Giddish', 'Ice-T', 'Peter Scanavino', 'Raúl Esparza', 'Sarah Booth', 'Ryan Metcalf', 'Joe Holt', 'Franky G', 'Brian Charles Johnson', 'Leslie Lyles', 'Betsy Aidem', 'Perry Yung', 'Steve Rosen', 'Kris Eivers', 'Stephen C. Bradbury', 'Joe Hansard', 'Chris LaPanta']"
18,13,Genes,"Wed, Mar 22, 2017",A suspect claims his genetics make him commit rape.,7.6,"https://m.media-amazon.com/images/M/MV5BMGI3MDFhNGEtNWNlZi00ODdjLTg0YWMtZjcxYWIwMDYxMzFiXkEyXkFqcGc@._V1_QL75_UX500_CR0,26,500,281_.jpg","['Mariska Hargitay', 'Kelli Giddish', 'Ice-T', 'Peter Scanavino', 'Raúl Esparza', 'Dalton Harrod', 'Michael Torpey', 'Emily Shaffer', 'Alex Hurt', 'Sean Patrick Reilly', 'Jared Zirilli', 'Catherine Wolf', 'Steve Rosen', 'Bill Irwin', 'Greg Germann', 'Eli Bridges', 'Christopher Halladay', 'Joel Brady']"
18,14,Net Worth,"Wed, Mar 29, 2017",An investment banker accuses her client of rape.,7.8,"https://m.media-amazon.com/images/M/MV5BZWQwYzQ4ZDYtNmNjNC00NTZkLThkODgtNThhMGJhZDI5OGU2XkEyXkFqcGc@._V1_QL75_UX500_CR0,26,500,281_.jpg","['Mariska Hargitay', 'Kelli Giddish', 'Ice-T', 'Peter Scanavino', 'Raúl Esparza', 'Missy Peregrym', 'Jordan Bridges', 'Will Brill', ""Kevin O'Rourke"", 'Matt Walton', 'Andy Wagner', 'Tate Donovan', 'Malikha Mallette', 'Erica Sweany', 'Barbara Miluski', 'Einar Gunn', 'Sulekha Ebelle', 'Sharinna Goyco']"
18,15,Know It All,"Wed, Apr 5, 2017",The suspect in a rape and murder investigation threatens to reveal the secrets of those working the case.,8.0,"https://m.media-amazon.com/images/M/MV5BMDcxYWVhNjctZmYxYS00NDFhLWFlYzUtNjg2NmEzM2NjZjQyXkEyXkFqcGc@._V1_QL75_UX500_CR0,26,500,281_.jpg","['Mariska Hargitay', 'Kelli Giddish', 'Ice-T', 'Peter Scanavino', 'Raúl Esparza', 'Chris Diamantopoulos', 'Jason Bowen', 'Megan Murphy', 'Meredith Travers', 'Bill Dawes', 'Max Baker', 'Mary E. Hodges', 'Jamie Effros', 'Megan Leung', 'Marianna Garcia', 'Tim Ewing', 'Gianna Yanelli', 'Bill Kocis']"
18,16,The Newsroom,"Wed, Apr 26, 2017",Benson and Barba ask witnesses to risk their jobs when a news anchor makes a rape accusation against her boss on the air.,8.0,"https://m.media-amazon.com/images/M/MV5BNTZhMmQxNWItMWE1OC00YTIzLTk1MGMtY2M0YzU0OGQwYjNiXkEyXkFqcGc@._V1_QL75_UX500_CR0,26,500,281_.jpg","['Mariska Hargitay', 'Kelli Giddish', 'Ice-T', 'Peter Scanavino', 'Raúl Esparza', 'Christopher McDonald', 'Bonnie Somerville', 'Mark Moses', 'Peyton List', 'J.C. MacKenzie', 'Beth Chamberlin', 'Jenna Stern', 'Paloma Guzmán', 'Joanne Baron', 'Peter Gallagher', 'Stephen C. Bradbury', 'Danny Wolohan', 'Jacob A. Ware']"
18,17,Real Fake News,"Wed, May 3, 2017","A congressman asks SVU for help when he's accused of soliciting underage girls, but the investigation uncovers a sex trafficking ring.",8.1,"https://m.media-amazon.com/images/M/MV5BNmQ1ZGE5NGItNzEwZS00OWU5LWFmZTItNTc0MmE0NzdkMDM2XkEyXkFqcGc@._V1_QL75_UX500_CR0,26,500,281_.jpg","['Mariska Hargitay', 'Kelli Giddish', 'Ice-T', 'Peter Scanavino', 'Raúl Esparza', 'Patch Darragh', 'Kevin Carolan', 'Tabitha Holbert', 'Steve Park', 'Brian McCarthy', 'Bronwyn Reed', 'Roslyn Ruff', 'James Waterston', 'Naiya Ortiz', 'Michael David Baldwin', 'Justin Ahdoot', 'Barbara Miluski', 'Jonathan Marimow']"
18,18,Spellbound,"Wed, May 10, 2017",A spiritual healer is accused of using hypnosis to sexually assault a client.,7.4,"https://m.media-amazon.com/images/M/MV5BM2IwZjAwNDctYjk3ZC00MDlmLTg0N2QtMzJmMTQ1NDY0MGMxXkEyXkFqcGc@._V1_QL75_UX500_CR0,26,500,281_.jpg","['Mariska Hargitay', 'Kelli Giddish', 'Ice-T', 'Peter Scanavino', 'Raúl Esparza', 'Kristen Hager', 'Elizabeth Marvel', 'John Ellison Conlee', 'Ami Brabson', 'Steven Hauck', 'Stuart Townsend', 'Lisa Gorlitsky', 'Akintola Jiboyewa', 'Whitney Bashor', 'Sam Edgerly', 'Kate Grimes', 'Scott Lehman', 'Regina Schneider']"
18,19,Conversion,"Wed, May 17, 2017",Barba must argue that the First Amendment does not give a person the right to break the law when a woman is raped by a member of her church group.,7.7,"https://m.media-amazon.com/images/M/MV5BNzljOWMyZTUtNDNhYi00NzhkLWE4ODMtOTI5NWI0MDMyZDMwXkEyXkFqcGc@._V1_QL75_UX500_CR0,26,500,281_.jpg","['Mariska Hargitay', 'Kelli Giddish', 'Ice-T', 'Peter Scanavino', 'Raúl Esparza', 'Kip Pardue', 'Michael Kostroff', 'Casey Cott', 'Jessie Carter', 'Sarah Nicole Deaver', 'Orlagh Cassidy', 'Zachary Knower', 'Michael Mastro', 'Tom Titone', 'Erica Camarano', 'Rebecca Krainik', 'Peter Graham', 'David Levi']"
18,20,American Dream,"Wed, May 24, 2017",The daughter of a Muslim family is killed in a hate crime against them; Barba is forced to drop charges against a suspect when a witness is deported; tensions rise between communities on both sides of the case.,7.7,"https://m.media-amazon.com/images/M/MV5BYzBiMjUwOTItYThiNS00YzFmLTkwZjUtZGE3YmQ3ODlmMDA1XkEyXkFqcGc@._V1_QL75_UX500_CR0,31,500,281_.jpg","['Mariska Hargitay', 'Kelli Giddish', 'Ice-T', 'Peter Scanavino', 'Raúl Esparza', 'Poorna Jagannathan', 'Melanie Chandra', 'Kirk Acevedo', 'Emma Myles', 'Matthew Rauch', 'Nik Sadhnani', 'Adam Arian', 'Tyler Elliot Burke', 'Ben Thompson', 'Gil Perez-Abraham', 'Massiel Mordan', 'Cara Ricketts', 'Meredith Holzman']"
18,21,Sanctuary,"Wed, May 24, 2017",Benson and Barba are caught between two families seeking justice for their loved ones in a hate crime; Benson takes desperate measures to make an arrest as public protests turn violent.,7.7,"https://m.media-amazon.com/images/M/MV5BNWZhZjEyMWYtNDczOC00MzhiLWFjNmQtMDhjZDFmY2M5YzM2XkEyXkFqcGc@._V1_QL75_UX500_CR0,47,500,281_.jpg","['Mariska Hargitay', 'Kelli Giddish', 'Ice-T', 'Peter Scanavino', 'Raúl Esparza', 'Poorna Jagannathan', 'Massiel Mordan', 'Shari Abdul', 'Kirk Acevedo', 'Billy Beyrer', 'Tyler Elliot Burke', 'Patrick Byas', 'Melanie Chandra', 'Richard R. Corapi', 'Steven DeMarco', 'Henry Gagliardi', 'Peter Gallagher', 'Karen Goeller']"
19,1,Gone Fishin',"Wed, Sep 27, 2017","Fin catches a fugitive rapist in Havana, but Barba's case is jeopardized by a political tug-of-war.",7.8,"https://m.media-amazon.com/images/M/MV5BMWJjYjMwMTctMWQyNy00NTVkLThhOWEtZDRjZjNjOTM2YmYyXkEyXkFqcGc@._V1_QL75_UX500_CR0,26,500,281_.jpg","['Mariska Hargitay', 'Kelli Giddish', 'Ice-T', 'Peter Scanavino', 'Raúl Esparza', 'Amy Smart', 'Mariela Garriga', 'Vincent Curatola', 'Dean Winters', 'Peter Jacobson', 'Will Chase', 'Syndee Winters', 'Mariah Lee', 'DeShawn White', 'Andrew Kaempfer', 'Barbara Miluski', 'Frank Rodriguez', 'J.B. Alexander']"
19,2,Mood,"Wed, Oct 4, 2017","The bizarre details of a woman's rape put the SVU at odds when Rollins and Carisi think her story is fabricated. Meanwhile, Benson goes on the offensive when her personal life is scrutinized.",7.9,"https://m.media-amazon.com/images/M/MV5BZjdkZDAwMDYtYzVkZi00NmFlLTg3N2MtYjNmY2U4ZjZhZmFkXkEyXkFqcGc@._V1_QL75_UX500_CR0,32,500,281_.jpg","['Mariska Hargitay', 'Kelli Giddish', 'Ice-T', 'Peter Scanavino', 'Raúl Esparza', 'Saxon Sharbino', 'Robbie Sublett', 'Amirah Vann', 'Christina Rouner', 'Dean Winters', 'Marion McCorry', 'Leah Curney', 'Shannon Marie Sullivan', 'Tommy Buck', 'Katy Grenfell', 'Spencer Hamp', 'Michelle Eugene', 'Ken Straus']"
19,3,Contrapasso,"Wed, Oct 11, 2017",Rollins and Carisi uncover 3 female suspects in the castration of a man who was left for dead. Langan has devastating news for Benson.,7.8,"https://m.media-amazon.com/images/M/MV5BOGVlYzNhNmQtN2JhMi00NTFjLWFhZmItZmNkNDQ4YTM5MWU5XkEyXkFqcGc@._V1_QL75_UX500_CR0,26,500,281_.jpg","['Mariska Hargitay', 'Kelli Giddish', 'Ice-T', 'Peter Scanavino', 'Raúl Esparza', 'Paul Fitzgerald', 'Kathleen Munroe', 'Jeannine Kaspar', 'Betsy Beutler', 'Peter Hermann', 'Ami Brabson', 'Yvonna Kopacz Wright', 'Annabeth Gish', 'Brooke Shields', 'Lauren Norvelle', 'Bisserat Tseggai', 'John Skelley', 'Gillian Glasco']"
19,4,No Good Reason,"Wed, Oct 18, 2017",A teenager disappears after schoolmates make her the subject of a vicious cyberbullying attack.,8.0,"https://m.media-amazon.com/images/M/MV5BYTUyMGQyMDEtYmE4Mi00MGE2LWE3YzQtYzU4ZmZhZWE4ZThjXkEyXkFqcGc@._V1_QL75_UX500_CR0,34,500,281_.jpg","['Mariska Hargitay', 'Kelli Giddish', 'Ice-T', 'Peter Scanavino', 'Raúl Esparza', 'Brighton Sharbino', 'Madison Pettis', 'Colton Ryan', 'Geraldine Hughes', 'Erin Davie', 'John Patrick Hayden', 'Steve Rosen', 'Helmar Augustus Cooper', 'Tyler Dean Flores', 'Katherine Reis', 'Gary Lee Mahmoud', 'David Raymond Wagner', 'Antonio Edwards Suarez']"
19,5,Complicated,"Wed, Oct 25, 2017","A young woman is found wandering alone in Central Park resulting in the reopening of a 10 year old case, while Olivia Benson and Sheila Porter go to family court regarding Noah.",7.9,"https://m.media-amazon.com/images/M/MV5BNmU3YWUxNWYtZDBlNC00YzU5LWFjZTQtYTVhZTM0ZDljYjIzXkEyXkFqcGc@._V1_QL75_UX500_CR0,26,500,281_.jpg","['Mariska Hargitay', 'Kelli Giddish', 'Ice-T', 'Peter Scanavino', 'Raúl Esparza', 'Paul Schulze', 'Kellie Overbey', 'Mike Faist', 'Iliana Raykovski', 'Peter Hermann', 'Jayne Houdyshell', 'Maureen Mueller', 'Brooke Shields', 'Isaiah Thomas', 'Lawrence Ballard', 'Tanya Rivero', 'KB Park', 'Max Pava']"
19,6,Unintended Consequences,"Wed, Nov 8, 2017","When a teenaged girl is found dead, Rollins goes undercover at a high-end rehab center where she was last seen alive. Meanwhile, Benson tries to overcome her doubts about Sheila.",7.9,"https://m.media-amazon.com/images/M/MV5BZjFjYTQ5M2MtODg0Yy00YWQwLWFhYWQtZGUxYTI3NzBjZmQ1XkEyXkFqcGc@._V1_QL75_UX500_CR0,26,500,281_.jpg","['Mariska Hargitay', 'Kelli Giddish', 'Ice-T', 'Peter Scanavino', 'Raúl Esparza', 'Annie Corley', 'Gus Birney', 'Christiane Noll', 'Robert Eli', 'Kathryn Kates', 'Peter Scolari', 'Brooke Shields', 'Noah Gaynor', 'Logan Rose Nelms', 'Jason Cadieux', 'Antino Crowley-Kamenwati', 'Angela Oh', 'Joshua Pagan']"
19,7,Something Happened,"Wed, Nov 29, 2017","Benson must disclose the secrets of her past to help a rape victim recall the details of one terrible, traumatic night.",7.3,"https://m.media-amazon.com/images/M/MV5BOTkyY2I1ZDgtNWMwOS00NmY0LWFiY2YtODY4MGJhMjI0OTg2XkEyXkFqcGc@._V1_QL75_UX500_CR0,234,500,281_.jpg","['Mariska Hargitay', 'Kelli Giddish', 'Ice-T', 'Peter Scanavino', 'Raúl Esparza', 'Melora Walters', 'Joanna Going', 'Chris Cafero', 'Crystal T. Johnson', 'Lana Young', 'Kayla Diaz', 'Tai Lyn Sandhu', 'Roger Brenner']"
19,8,Intent,"Wed, Dec 6, 2017","The cops get tangled in an elaborate online hoax that leads to the rape of a popular social media star. Meanwhile, Benson sets firm ground rules with Sheila.",8.2,"https://m.media-amazon.com/images/M/MV5BYjM5MDhlODMtZjc3YS00MDlkLWE4OTktYWQ2ZjUwNzQzNDUzXkEyXkFqcGc@._V1_QL75_UX500_CR0,26,500,281_.jpg","['Mariska Hargitay', 'Kelli Giddish', 'Ice-T', 'Peter Scanavino', 'Raúl Esparza', 'Steve Howey', 'Gage Golightly', 'James Monroe Iglehart', 'Tenea Intriago', 'Nick Sullivan', 'Glenn Fleshler', 'Brooke Shields', 'Ben Roberts', 'Barbara Kingsley', 'Gillian Glasco', 'Valerie Kingston', 'Anthoula Katsimatides', 'Ava DeMary']"
19,9,Gone Baby Gone,"Wed, Jan 3, 2018",Emotions run high as the SVU squad searches frantically for Benson's missing son.,8.5,"https://m.media-amazon.com/images/M/MV5BZDAyYWIzODEtN2M3YS00ZWM4LWEwNTMtOTZhNzFhYzljN2M1XkEyXkFqcGc@._V1_QL75_UX500_CR0,26,500,281_.jpg","['Mariska Hargitay', 'Kelli Giddish', 'Ice-T', 'Peter Scanavino', 'Raúl Esparza', 'Brooke Shields', 'Frank Pando', 'Maureen Mueller', 'Peter Gallagher', 'Domenica Feraud', 'Kelvin McGrue', 'Brian Berrebbi', 'Collin Meath', 'Lawrence Clayton', 'Gannon McHale', 'Nesha Ward', 'Kelly Felthous', 'Olivia R Luna']"
19,10,Pathological,"Wed, Jan 10, 2018","When the SVU investigates a case involving two students in a special needs school, Rollins discovers that one child's medical issues stem from a surprising source.",8.2,"https://m.media-amazon.com/images/M/MV5BZTkxZjk1YTEtOTA2MC00MTk0LWI3MzktOWMyZTU3MWJjNmM3XkEyXkFqcGc@._V1_QL75_UX500_CR0,26,500,281_.jpg","['Mariska Hargitay', 'Kelli Giddish', 'Ice-T', 'Peter Scanavino', 'Raúl Esparza', 'Dendrie Taylor', 'Erin Wilhelmi', 'Mouzam Makkar', 'Jenna Stern', 'George R. Sheffey', 'Mandi Masden', 'Carolyn McCormick', 'Tamara Tunie', 'Joanna Parson', 'Jon Shaver', 'Andrea Cirie', 'Conor Tague', 'Tywan Wade']"
19,11,Flight Risk,"Wed, Jan 17, 2018","When an airline pilot accuses her captain of sexual assault, Barba convenes a grand jury to determine their employer's complicity in the crime. Meanwhile, Fin takes steps to ensure Benson is protected at work.",7.8,"https://m.media-amazon.com/images/M/MV5BZmE2N2ZiZTAtMWRlYy00OGZlLWE4M2YtZmQ5YzdlYWY0Y2I3XkEyXkFqcGc@._V1_QL75_UX500_CR0,26,500,281_.jpg","['Mariska Hargitay', 'Kelli Giddish', 'Ice-T', 'Peter Scanavino', 'Raúl Esparza', 'Yasmine Al Massri', 'Ned Eisenberg', 'Roxanna Hope Radja', 'Anastasia Barzee', 'Reg Rogers', 'Martin Donovan', 'Peter Gallagher', 'Ana Maria Jomolca', 'Blair Busbee', 'Tyrone Mitchell Henderson', 'Sonia Manzano', 'Iliana Guibert', 'Tom Day']"
19,12,Info Wars,"Wed, Jan 31, 2018","After a female pundit is assaulted during a protest, Benson and Barba struggle to put their political beliefs aside in order to help bring the attacker to justice.",6.3,"https://m.media-amazon.com/images/M/MV5BNTdiNzU5NDAtMzgwZC00ZDdlLTlhMmEtN2M3M2NiNDRlYTVlXkEyXkFqcGc@._V1_QL75_UX500_CR0,26,500,281_.jpg","['Mariska Hargitay', 'Kelli Giddish', 'Ice-T', 'Peter Scanavino', 'Raúl Esparza', 'Rhea Seehorn', 'Kurt Fuller', 'Joe Grifasi', 'Jonathan Judge-Russo', 'Adam Zastrow', 'Lee Roy Rogers', 'Lisa Helmi Johanson', 'Tuck Sweeney', 'Maceo Oliver', 'Lars Engstrom', 'Amber Jaunai', 'James Chery', 'Tam Young']"
19,13,The Undiscovered Country,"Wed, Feb 7, 2018","When an infant goes missing, detectives take sides in the family's right-to-die court case. Meanwhile, Barba's interference in the case puts the whole DA's office in jeopardy.",8.4,"https://m.media-amazon.com/images/M/MV5BZjgyMmE1Y2UtZTg0ZC00MDJjLWI1NjgtY2I5ZDE2MzAyMDJlXkEyXkFqcGc@._V1_QL75_UX500_CR0,26,500,281_.jpg","['Mariska Hargitay', 'Kelli Giddish', 'Ice-T', 'Peter Scanavino', 'Raúl Esparza', 'Philip Winchester', 'Peter Jacobson', 'Abigail Hawk', 'Joe Tapper', 'Ami Brabson', 'Sam Waterston', 'Damien Brett', 'Lindsay Becker', 'Precious Cruz-Dyson', 'Sprague Theobald', 'David Adams', 'Courtney Gonzalez', 'David Karges']"
19,14,Chasing Demons,"Wed, Feb 28, 2018",A doctor who was arrested for sexually abusing his patients is set free due to Cassidy's testimony which results in a mistrial.,7.9,"https://m.media-amazon.com/images/M/MV5BMTYxNTg0NTYtYjQ1NC00NzljLThlYTMtZTExN2YyMmQ4MmNkXkEyXkFqcGc@._V1_QL75_UX500_CR0,26,500,281_.jpg","['Mariska Hargitay', 'Kelli Giddish', 'Ice-T', 'Peter Scanavino', 'Philip Winchester', 'Kylie Bunbury', 'Pernell Walker', 'Dominic Colón', 'Karina Arroyave', 'Dov Tiefenbach', 'Kathryn Kates', 'Daryl Edwards', 'Stephen Hill', 'Brett Gray', 'Dean Winters', 'Molly Jobe', 'Anthony Robert Grasso', 'Barrett Shuler']"
19,15,In Loco Parentis,"Wed, Mar 7, 2018",Carisi's niece reports a classmate's sexual assault; Stone discovers that there aren't any perfect witnesses when it comes to sex crimes.,7.1,"https://m.media-amazon.com/images/M/MV5BMTUyYTU2MzctNmIwMy00MjY1LTk3NGItNzViZmRhNjljMTVmXkEyXkFqcGc@._V1_QL75_UX500_CR0,26,500,281_.jpg","['Mariska Hargitay', 'Kelli Giddish', 'Ice-T', 'Peter Scanavino', 'Philip Winchester', 'Rachel Bay Jones', 'Ryann Shane', 'Sam Vartholomeos', 'Tijuana Ricks', 'John Rothman', 'Susie Essman', 'Dominic Comperatore', 'Barbra Wengerd', 'Rachel Finninger', 'Amanda Debraux', 'Bjorn Thorstad', 'Zeus Taylor', 'Jason Liebman']"
19,16,Dare,"Wed, Mar 14, 2018",A girl's death becomes a criminal case when a surgeon harvests her organs without parental consent.,8.3,"https://m.media-amazon.com/images/M/MV5BM2M5YjNlNzMtNDQ1My00NWI0LTg1MTEtMDMzMTJkOTM3ZDQ5XkEyXkFqcGc@._V1_QL75_UX500_CR0,26,500,281_.jpg","['Mariska Hargitay', 'Kelli Giddish', 'Ice-T', 'Peter Scanavino', 'Philip Winchester', 'Janel Moloney', 'Jenn Gambatese', 'Alfredo Narciso', 'Tom Titone', 'Eloise Lushina', 'Lillian Ellen Jones', 'Nicolette Pierini', 'Callie Thorne', ""Kittson O'Neill"", 'James Mount', 'Harriett D. Foy', 'Stacey Raymond', 'Adit Dileep']"
19,17,Send in the Clowns,"Wed, Mar 21, 2018",The cops search for a masked man when a student vanishes during a field trip to New York City.,8.2,"https://m.media-amazon.com/images/M/MV5BZjU5MWJiYmUtZDJiYi00ZTY1LTk1ZDctNWRkZGZmMjQ5NGQ1XkEyXkFqcGc@._V1_QL75_UX500_CR0,26,500,281_.jpg","['Mariska Hargitay', 'Kelli Giddish', 'Ice-T', 'Peter Scanavino', 'Philip Winchester', 'Will Sasso', 'Erik Jensen', 'Wendy Hoopes', 'Ernest Waddell', 'Migs Govea', 'Eric Tabach', 'Mallory Bechtel', 'Molly Brown', 'Helmar Augustus Cooper', 'Don Stephenson', 'Valeri Mudek', 'Jillian Louis', 'Cyndi Melendez']"
19,18,Service,"Wed, Apr 11, 2018",The SVU must break through military red tape when a soldier is suspected of sexual assault.,7.7,"https://m.media-amazon.com/images/M/MV5BNmZmOGJlZmEtZTQ0Zi00ODNmLWFlZjctMjMwZTQxMDQyNTgxXkEyXkFqcGc@._V1_QL75_UX500_CR0,25,500,281_.jpg","['Mariska Hargitay', 'Kelli Giddish', 'Ice-T', 'Peter Scanavino', 'Philip Winchester', 'Christopher Wiehl', 'Morgan Taylor Campbell', 'Marquise Vilsón', 'Jack DiFalco', 'Timothy Adams', 'Yvonna Kopacz Wright', 'Michael Mastro', 'Wayne Knight', 'Mary E. Hodges', 'Josh Rhett Noble', 'Jonathan Castro', 'Eric Rizk', 'Jill Durso']"
