Season,Episode,Title,Air Date,Description,Rating,Image URL,Main Cast
7,14,Taboo,"Tue, Jan 17, 2006","When a baby boy is discovered in the rubbish, detectives Benson and Stabler use a t-shirt found at the scene to trace the crime back to a well-to-do college student.",8.0,"https://m.media-amazon.com/images/M/MV5BMjM3NTczMjUxN15BMl5BanBnXkFtZTgwNDEwODc3MjE@._V1_QL75_UX500_CR0,47,500,281_.jpg","['Christopher Meloni', 'Mariska Hargitay', 'Richard Belzer', 'Diane Neal', 'Ice-T', 'BD Wong', 'Tamara Tunie', 'Dann Florek', 'Schuyler Fisk', 'Patricia Kalember', 'Mike Doyle', 'Annie Golden', 'Alexandra Neil', 'Curtis Mark Williams', 'Audrie Neenan', 'Michael Lerner', 'Zeljko Ivanek', 'Piter Marek']"
7,15,Manipulated,"Tue, Feb 7, 2006",A successful lawyer's secret life as an exotic dancer is revealed to her boss and her fiancé after she and a stripper friend are found murdered.,8.3,"https://m.media-amazon.com/images/M/MV5BMjMyMzk4ODI5OV5BMl5BanBnXkFtZTgwMTQ5Njg3MjE@._V1_QL75_UX500_CR0,47,500,281_.jpg","['Christopher Meloni', 'Mariska Hargitay', 'Richard Belzer', 'Diane Neal', 'Ice-T', 'BD Wong', 'Tamara Tunie', 'Dann Florek', 'Rebecca De Mornay', 'Ned Eisenberg', 'Brian Slaten', 'Joel de la Fuente', 'Mike Doyle', 'Kevin Carrigan', 'Joanna Merlin', 'Holt McCallany', 'Chris Potter', 'Betty Buckley']"
7,16,Gone,"Tue, Feb 28, 2006",A female student from Montreal goes missing during a class trip to New York City after she spends a night partying with three cocky prep school boys.,8.4,"https://m.media-amazon.com/images/M/MV5BMTkwMzYxODMyOF5BMl5BanBnXkFtZTgwNzY5Njg3MjE@._V1_QL75_UX500_CR0,47,500,281_.jpg","['Christopher Meloni', 'Mariska Hargitay', 'Richard Belzer', 'Diane Neal', 'Ice-T', 'BD Wong', 'Tamara Tunie', 'Dann Florek', 'Harry Zittel', 'Teddy Eck', 'Paul David Story', 'Mike Doyle', 'Joel de la Fuente', 'Fred Thompson', 'Judith Light', 'Susan Saint James', 'Michael Boatman', 'Barry Bostwick']"
7,17,Class,"Tue, Mar 21, 2006","A Hudson University co-ed dependent on financial aid is found murdered with an unexplained influx of cash. Her wealthy roommate is found with one of her rings, making her a suspect as the two were not friends. Benson, Fin, and Stabler have several theories about her murderer and their motive and investigate the various suspects; the roommate, her childhood friend, and someone connected to a heavily trafficked website where the victim was selling term papers for cash.",7.6,"https://m.media-amazon.com/images/M/MV5BMTk5MTA0OTk3MF5BMl5BanBnXkFtZTgwNzIwNTg3MjE@._V1_QL75_UX500_CR0,47,500,281_.jpg","['Christopher Meloni', 'Mariska Hargitay', 'Richard Belzer', 'Diane Neal', 'Ice-T', 'BD Wong', 'Tamara Tunie', 'Dann Florek', 'Will Estes', 'Trieste Kelly Dunn', 'Nick Sandow', 'Joel de la Fuente', 'Joanna Merlin', 'Caren Browning', 'Mathew St. Patrick', 'Joey Slotnick', 'Don Sparks', 'Scott Bailey']"
7,18,Venom,"Tue, Mar 28, 2006","Detective Tutuola is torn between his work and family when his son, Ken, is implicated in a crime. While investigating, Detectives Benson and Stabler find themselves with a much bigger crime.",8.4,"https://m.media-amazon.com/images/M/MV5BMTkzNTE3MDQ2OF5BMl5BanBnXkFtZTgwODIyNjc3MjE@._V1_QL75_UX500_CR0,47,500,281_.jpg","['Christopher Meloni', 'Mariska Hargitay', 'Richard Belzer', 'Diane Neal', 'Ice-T', 'BD Wong', 'Tamara Tunie', 'Dann Florek', 'LisaGay Hamilton', 'Ernest Waddell', 'Joe Grifasi', 'Darnell Williams', 'Stephanie Berry', 'Audrie Neenan', 'Caren Browning', 'Ludacris', 'Tiffany Michelle Thompson', 'Scott Nicholson']"
7,19,Fault,"Tue, Apr 4, 2006",A serial pedophile murders members of a family and runs off with the two younger children prompting a citywide manhunt.,8.7,"https://m.media-amazon.com/images/M/MV5BNzc2Mjk0ODkwM15BMl5BanBnXkFtZTgwNjA5ODc3MjE@._V1_QL75_UX500_CR0,47,500,281_.jpg","['Christopher Meloni', 'Mariska Hargitay', 'Richard Belzer', 'Diane Neal', 'Ice-T', 'BD Wong', 'Tamara Tunie', 'Dann Florek', 'Lou Diamond Phillips', 'Mike Doyle', 'Joel de la Fuente', 'Rebecca Wisocky', 'Jeff Biehl', 'Felecia M. Bell', 'Matt Landers', 'Craig McEldowney', 'Kevin R. Free', 'Ray Garvey']"
7,20,Fat,"Tue, May 2, 2006","Stabler and his one-time partner, Lucius Blaine, investigate a case dealing with childhood obesity.",7.8,"https://m.media-amazon.com/images/M/MV5BMjE5ODA3OTg5NV5BMl5BanBnXkFtZTgwMDE5ODc3MjE@._V1_QL75_UX500_CR0,47,500,281_.jpg","['Christopher Meloni', 'Mariska Hargitay', 'Richard Belzer', 'Diane Neal', 'Ice-T', 'BD Wong', 'Tamara Tunie', 'Dann Florek', 'Anthony Anderson', 'Natalie Cole', 'Rooney Mara', 'David Thornton', 'David Bishins', 'Mike Doyle', 'José Ramón Rosario', 'Peter McRobbie', 'Paul Calderon', 'Omar Benson Miller']"
7,21,Web,"Tue, May 9, 2006","After a young boy claims molestation, the investigation turns from his pedophile father to another family member.",8.2,"https://m.media-amazon.com/images/M/MV5BMjM1MDEzOTYyN15BMl5BanBnXkFtZTgwNTkxMzg3MjE@._V1_QL75_UX500_CR0,47,500,281_.jpg","['Christopher Meloni', 'Mariska Hargitay', 'Richard Belzer', 'Diane Neal', 'Ice-T', 'BD Wong', 'Tamara Tunie', 'Dann Florek', 'Dana Eskelson', 'Connor Paolo', 'Joel de la Fuente', 'Gregg Edelman', 'Tim Hopper', 'Peter Hermann', 'Marla Sucharetza', 'Kate Mulgrew', 'Drew Battles', 'Jack Vignone']"
7,22,Influence,"Tue, May 16, 2006",An unstable woman stops taking medication and mows down 10 people with her car; a former rock star wages an anti-psychiatric-drug campaign.,8.0,"https://m.media-amazon.com/images/M/MV5BMTQxNDA1NDY0MF5BMl5BanBnXkFtZTgwNjk4NDc3MjE@._V1_QL75_UX500_CR0,47,500,281_.jpg","['Christopher Meloni', 'Mariska Hargitay', 'Richard Belzer', 'Diane Neal', 'Ice-T', 'BD Wong', 'Tamara Tunie', 'Dann Florek', 'Brittany Snow', 'Peter Riegert', 'Jeff McCarthy', 'Marsha Dietlein', 'Stephen Gregory', 'JillMarie Lawrence', ""Tom O'Rourke"", 'James Murtaugh', 'Audrie Neenan', 'Caren Browning']"
8,1,Informed,"Tue, Sep 19, 2006","When a particularly brutalized rape victim resists all efforts to help her, Olivia takes her as a cause and turns up an old acquaintance during the investigation.",8.0,"https://m.media-amazon.com/images/M/MV5BNTk2NTAwNzk5MF5BMl5BanBnXkFtZTcwNzE3MzYwMg@@._V1_QL75_UX500_CR0,201,500,281_.jpg","['Christopher Meloni', 'Mariska Hargitay', 'Richard Belzer', 'Diane Neal', 'Ice-T', 'BD Wong', 'Tamara Tunie', 'Dann Florek', 'Marcia Gay Harden', 'Kristen Bush', 'Alan Campbell', 'Ebon Moss-Bachrach', 'Joanna Adler', ""John O'Creagh"", 'Lisa Strum', 'Jefferson Breland', 'Christopher Sapienza', 'Amber Gross']"
8,2,Clock,"Tue, Sep 26, 2006","A 17-year-old with the features of a little girl is kidnapped. Stabler sees parallels with his own daughter, and must deal with a new partner.",7.7,"https://m.media-amazon.com/images/M/MV5BMjE0MTc1MzY2NF5BMl5BanBnXkFtZTgwMjA1Mjg3MjE@._V1_QL75_UX500_CR0,47,500,281_.jpg","['Christopher Meloni', 'Mariska Hargitay', 'Richard Belzer', 'Diane Neal', 'Ice-T', 'BD Wong', 'Tamara Tunie', 'Dann Florek', 'Connie Nielsen', 'Gregory Harrison', 'Betsy Hogg', 'Deborah Raffin', 'Jason Butler Harner', 'Larry Pine', 'Isabel Gillies', 'Joel de la Fuente', 'Stephen Gregory', 'Stephen McKinley Henderson']"
8,3,Recall,"Tue, Oct 3, 2006",Stabler and his new partner go after a possible serial rapist with the help of an unlikely victim from 30 years earlier.,8.2,"https://m.media-amazon.com/images/M/MV5BMjAyMDgxNDI3OF5BMl5BanBnXkFtZTgwNTY0Nzg3MjE@._V1_QL75_UX500_CR0,47,500,281_.jpg","['Christopher Meloni', 'Mariska Hargitay', 'Richard Belzer', 'Diane Neal', 'Ice-T', 'BD Wong', 'Tamara Tunie', 'Dann Florek', 'Connie Nielsen', 'Leslie Caron', 'Charles Shaughnessy', 'Robin Weigert', 'Lily Rabe', 'Mike Doyle', 'Meg Gibson', 'Joanna Merlin', 'James Naughton', 'Philip Levy']"
8,4,Uncle,"Tue, Oct 10, 2006","A homeless man is suspected of murder. As the case unfolds, so do Munch's family secrets.",8.0,"https://m.media-amazon.com/images/M/MV5BMTgxMTkwNTkwMl5BMl5BanBnXkFtZTgwODMzMzg3MjE@._V1_QL75_UX500_CR0,47,500,281_.jpg","['Christopher Meloni', 'Mariska Hargitay', 'Richard Belzer', 'Diane Neal', 'Ice-T', 'BD Wong', 'Tamara Tunie', 'Dann Florek', 'Connie Nielsen', 'Jerry Lewis', 'Timothy Adams', 'William Hill', 'Peter McRobbie', 'JillMarie Lawrence', 'Caren Browning', 'Ali Reza', 'Ryan Brown', 'Jana Robbins']"
8,5,Confrontation,"Tue, Oct 17, 2006",Stabler and Beck track down a serial rapist who repeatedly attacks his victims based on their ovulation cycles so that he can impregnate them.,8.0,"https://m.media-amazon.com/images/M/MV5BMTgyMDYxNjA1MF5BMl5BanBnXkFtZTgwMjE1MTg3MjE@._V1_QL75_UX500_CR0,47,500,281_.jpg","['Christopher Meloni', 'Mariska Hargitay', 'Richard Belzer', 'Diane Neal', 'Ice-T', 'BD Wong', 'Tamara Tunie', 'Dann Florek', 'Connie Nielsen', 'Michael Kelly', ""Kerry O'Malley"", 'Matthew Arkin', 'Marin Ireland', 'Patricia Kalember', 'Caren Browning', 'John Michael Bolger', 'Eleanor Hutchins', 'Mariette Hartley']"
8,6,Infiltrated,"Tue, Oct 31, 2006","The environmental group Olivia is infiltrating for the FBI is accused of murdering the CEO of a pharmaceutical company. But when she discovers that the crime may be sexual in nature, she conducts her own independent investigation.",8.2,"https://m.media-amazon.com/images/M/MV5BMjczNDU4MTAxMF5BMl5BanBnXkFtZTgwMTcwMDg3MjE@._V1_QL75_UX500_CR0,47,500,281_.jpg","['Christopher Meloni', 'Mariska Hargitay', 'Richard Belzer', 'Diane Neal', 'Ice-T', 'BD Wong', 'Tamara Tunie', 'Dann Florek', 'Debra Jo Rupp', 'Steven Rishard', 'Chris Bowers', 'Maria Thayer', 'Ned Eisenberg', 'Frederick Strother', 'Vincent Spano', 'Charles Martin Smith', 'Kelly McAndrew', 'Molly Camp']"
8,7,Underbelly,"Tue, Nov 14, 2006",Three teenage homicide victims with matching tattoos lead Detectives Stabler and Beck to an underage prostitution ring.,7.7,"https://m.media-amazon.com/images/M/MV5BMTUzMDc2NDY0M15BMl5BanBnXkFtZTgwOTcwMjg3MjE@._V1_QL75_UX500_CR0,47,500,281_.jpg","['Christopher Meloni', 'Mariska Hargitay', 'Richard Belzer', 'Diane Neal', 'Ice-T', 'BD Wong', 'Tamara Tunie', 'Dann Florek', 'Connie Nielsen', 'Michael Kenneth Williams', 'Charlotte Ray Rosenberg', 'Victor Slezak', 'JoAnna Rhinehart', 'Joe Grifasi', 'Lynda Gravatt', 'Julito McCullum', 'Charlayne Woodard', 'Luther Creek']"
8,8,Cage,"Tue, Nov 21, 2006",SVU investigates a shady private adoption agency after two undocumented children are found deserted near an automobile accident.,8.2,"https://m.media-amazon.com/images/M/MV5BMTk5NjM1NTk2MV5BMl5BanBnXkFtZTgwNDkyODg3MjE@._V1_QL75_UX500_CR0,47,500,281_.jpg","['Christopher Meloni', 'Mariska Hargitay', 'Richard Belzer', 'Diane Neal', 'Ice-T', 'BD Wong', 'Tamara Tunie', 'Dann Florek', 'Connie Nielsen', 'Elle Fanning', 'Margo Martindale', 'Leo Burmester', 'Marlyne Barrett', 'Louis Mustillo', 'Philip Bosco', 'Isabel Gillies', 'Mike Doyle', 'Bob Ari']"
8,9,Choreographed,"Tue, Nov 28, 2006","A model is poisoned to death, and it could be connected to a love triangle between her manipulative choreographer husband, his mistress, and the mistress' jealous husband.",8.0,"https://m.media-amazon.com/images/M/MV5BMzk3ODg4NzY5OV5BMl5BanBnXkFtZTgwNTkyODg3MjE@._V1_QL75_UX500_CR0,47,500,281_.jpg","['Christopher Meloni', 'Mariska Hargitay', 'Richard Belzer', 'Diane Neal', 'Ice-T', 'BD Wong', 'Tamara Tunie', 'Dann Florek', 'Bob Saget', 'Alan Davidson', 'Sean Haberle', 'Joel de la Fuente', 'Al Brown', 'David Wilson Barnes', 'Caren Browning', 'Kristine Szabo', 'Bernadette Peters', 'Catherine Bell']"
8,10,Scheherazade,"Tue, Jan 2, 2007","A dying man's confessions to Benson and Stabler reveal secrets about the true identity of his estranged daughter and other, more disturbing secrets.",8.6,"https://m.media-amazon.com/images/M/MV5BMjkzODY2NTU0NF5BMl5BanBnXkFtZTgwODAxNDg3MjE@._V1_QL75_UX500_CR0,47,500,281_.jpg","['Christopher Meloni', 'Mariska Hargitay', 'Richard Belzer', 'Diane Neal', 'Ice-T', 'BD Wong', 'Tamara Tunie', 'Dann Florek', 'Brian Dennehy', 'John Doman', 'Isabel Gillies', 'Paget Brewster', 'Karen Ziemba', 'Victoria Wyndham', 'Judith Light', 'Mike Doyle', 'Karl Kenzler', 'Malachy Cleary']"
8,11,Burned,"Tue, Jan 9, 2007",A bitter estrangement pits divorcing couple Miles and Valerie Sennet against one another with tragic consequences.,8.3,"https://m.media-amazon.com/images/M/MV5BMjM4NjQ2NzYyNl5BMl5BanBnXkFtZTgwNzAxNDg3MjE@._V1_QL75_UX500_CR0,47,500,281_.jpg","['Christopher Meloni', 'Mariska Hargitay', 'Richard Belzer', 'Diane Neal', 'Ice-T', 'BD Wong', 'Tamara Tunie', 'Dann Florek', 'Blair Underwood', 'Tiffany Evans', 'Peter Gerety', 'Isabel Gillies', 'Liza Lapira', 'Maureen Mueller', 'Danny Johnson', 'JillMarie Lawrence', 'Joanna Merlin', 'Michael Michele']"
8,12,Outsider,"Tue, Jan 16, 2007",Fin reluctantly works with a Brooklyn detective who thinks that Fin's rape cases are connected to his unsolved murder cases.,7.7,"https://m.media-amazon.com/images/M/MV5BNjc3NzY3MDI4OV5BMl5BanBnXkFtZTgwMjA0MDg3MjE@._V1_QL75_UX500_CR0,47,500,281_.jpg","['Christopher Meloni', 'Mariska Hargitay', 'Richard Belzer', 'Diane Neal', 'Ice-T', 'BD Wong', 'Tamara Tunie', 'Dann Florek', 'Adam Beach', 'Navid Negahban', 'Tiffany Pao', 'Ernest Waddell', 'Sakina Jaffrey', 'Pooja Kumar', 'Yin Chang', 'Mark La Mura', 'Carmen Goodine', 'Sharon Wilkins']"
8,13,Loophole,"Tue, Feb 6, 2007",An investigation into a potential child pornography case actually uncovers a chemical company testing possibly toxic products on a group of building tenants.,8.0,"https://m.media-amazon.com/images/M/MV5BMjExMTQ0NTIzM15BMl5BanBnXkFtZTgwNTcwOTc3MjE@._V1_QL75_UX500_CR0,47,500,281_.jpg","['Christopher Meloni', 'Mariska Hargitay', 'Richard Belzer', 'Diane Neal', 'Ice-T', 'BD Wong', 'Tamara Tunie', 'Dann Florek', 'Wayne Duvall', 'Karen Olivo', 'Peter Riegert', 'Justin McCarthy', 'Bill Goldberg', 'Casey Siemaszko', 'Mike Doyle', 'Joel de la Fuente', 'Anne James', 'Peter McRobbie']"
8,14,Dependent,"Tue, Feb 13, 2007","A woman is murdered and her husband attacked, with their 6 year old son a witness to the attack. The man awakens in the hospital and remembers seeing his teenage daughter at the scene.",8.1,"https://m.media-amazon.com/images/M/MV5BMjA1NzU0MTgxMV5BMl5BanBnXkFtZTgwMTc3Njg3MjE@._V1_QL75_UX500_CR0,47,500,281_.jpg","['Christopher Meloni', 'Mariska Hargitay', 'Richard Belzer', 'Diane Neal', 'Ice-T', 'BD Wong', 'Tamara Tunie', 'Dann Florek', 'Emily VanCamp', 'Robert John Burke', 'Seamus Davey-Fitzpatrick', 'Isabel Gillies', 'Liza Lapira', 'Ned Bellamy', 'Albert Jones', 'Justin Klosky', 'Cary Elwes', 'Allison Hirschlag']"
8,15,Haystack,"Tue, Feb 20, 2007","A woman accused of killing her baby commits suicide after being interrogated by an overzealous television reporter. It later turns out that the baby was kidnapped, perhaps by the baby's biological father.",7.9,"https://m.media-amazon.com/images/M/MV5BMjM2NDQzODU0N15BMl5BanBnXkFtZTgwMzIwOTc3MjE@._V1_QL75_UX500_CR0,47,500,281_.jpg","['Christopher Meloni', 'Mariska Hargitay', 'Richard Belzer', 'Diane Neal', 'Ice-T', 'BD Wong', 'Tamara Tunie', 'Dann Florek', 'Ashley Williams', 'Pablo Schreiber', 'Dana Ashbrook', 'Kali Rocha', 'David Thornton', 'Kathleen Chalfant', 'Mike Doyle', 'Joel de la Fuente', ""Jack O'Connell"", 'Ali Reza']"
8,16,Philadelphia,"Tue, Feb 27, 2007","Olivia finds her biological brother in New Jersey, but discovers that he is under investigation by local police for sexual crimes. But her obsession with finding him puts another investigation in jeopardy as well as her partnership with Elliot.",8.0,"https://m.media-amazon.com/images/M/MV5BNDIwNzg0MDE1NF5BMl5BanBnXkFtZTgwNzQwOTc3MjE@._V1_QL75_UX500_CR0,47,500,281_.jpg","['Christopher Meloni', 'Mariska Hargitay', 'Richard Belzer', 'Diane Neal', 'Ice-T', 'BD Wong', 'Tamara Tunie', 'Dann Florek', 'Kim Delaney', 'Michael Weston', 'Roberto Davide', 'Gregory Alan Williams', 'Rick Otto', 'Mike Doyle', 'Joel de la Fuente', 'Mary Stuart Masterson', 'Jonathan Kells Phillips', 'Arian Moayed']"
8,17,Sin,"Tue, Mar 27, 2007","A gay male sex worker is murdered, and the investigation reveals that a pastor who preaches extreme intolerance toward homosexuals may have had a relationship with him.",8.0,"https://m.media-amazon.com/images/M/MV5BMTk4MjI2MTU2MF5BMl5BanBnXkFtZTgwODIyOTc3MjE@._V1_QL75_UX500_CR0,47,500,281_.jpg","['Christopher Meloni', 'Mariska Hargitay', 'Richard Belzer', 'Diane Neal', 'Ice-T', 'BD Wong', 'Tamara Tunie', 'Dann Florek', 'Tim Daly', 'Corey Sorenson', 'Manny Perez', 'Chad Hoeppner', 'Mike Doyle', 'Joel de la Fuente', 'John Cullum', 'Kathy Baker', 'Amie Tedesco', 'Karl Kenzler']"
8,18,Responsible,"Tue, Apr 3, 2007","The mother of a high school girl is caught having a sexual relationship with one of her daughter's classmates, and she may have supplied alcohol for a high school party where another student died.",8.2,"https://m.media-amazon.com/images/M/MV5BMTk1Nzg1NTUwMF5BMl5BanBnXkFtZTgwMDYzNjc3MjE@._V1_QL75_UX500_CR0,47,500,281_.jpg","['Christopher Meloni', 'Mariska Hargitay', 'Richard Belzer', 'Diane Neal', 'Ice-T', 'BD Wong', 'Tamara Tunie', 'Dann Florek', 'Laura Leighton', 'Hunter Parrish', 'Sarah Drew', 'Leven Rambin', 'Van Hughes', 'Rob Mayes', 'Peter Hermann', 'JillMarie Lawrence', 'Neal Matarazzo', 'Kelly Rebecca Walsh']"
8,19,Florida,"Tue, May 1, 2007","Benson (Mariska Hargitay) hears from her half-brother (Michael Weston), who is on the run because of sexual assault charges. He continues to claim his innocence, though because evidence continues to pile up against him, Benson reluctantly agrees to help in the investigation.",8.3,"https://m.media-amazon.com/images/M/MV5BMTAxMTEwNjY1MzZeQTJeQWpwZ15BbWU4MDgzMDk3NzIx._V1_QL75_UX500_CR0,47,500,281_.jpg","['Christopher Meloni', 'Mariska Hargitay', 'Richard Belzer', 'Diane Neal', 'Ice-T', 'BD Wong', 'Tamara Tunie', 'Dann Florek', 'Kim Delaney', 'Michael Weston', 'Josh Casaubon', 'Kathryn Hays', 'Mike Doyle', 'Graham Winton', 'Maggie Burke', 'Frankie Faison', 'Vincent Spano', 'Alex Wipf']"
8,20,Annihilated,"Tue, May 8, 2007","The investigation of a bride-to-be's murder uncovers a man's double life; a turn in the case rattles Stabler, who turns to his wife and children for comfort.",8.1,"https://m.media-amazon.com/images/M/MV5BMTA2MTYyNTU4NjJeQTJeQWpwZ15BbWU4MDU1NzA4NzIx._V1_QL75_UX500_CR0,47,500,281_.jpg","['Christopher Meloni', 'Mariska Hargitay', 'Richard Belzer', 'Diane Neal', 'Ice-T', 'BD Wong', 'Tamara Tunie', 'Dann Florek', 'Dylan Walsh', 'Kelly Deadmon', 'Isabel Gillies', 'Mike Doyle', 'John Douglas Thompson', 'Paolo Montalban', 'Reade Kelly', 'Annie McGreevey', 'Paul Urcioli', 'Rachel Stern']"
8,21,Pretend,"Tue, May 15, 2007",The investigation into an extreme fighting death leads to the discovery of a 28-year-old woman posing as a 16-year-old high school student.,8.3,"https://m.media-amazon.com/images/M/MV5BMTY3NTM4ODA4MF5BMl5BanBnXkFtZTgwODcyODg3MjE@._V1_QL75_UX500_CR0,47,500,281_.jpg","['Christopher Meloni', 'Mariska Hargitay', 'Richard Belzer', 'Diane Neal', 'Ice-T', 'BD Wong', 'Tamara Tunie', 'Dann Florek', 'Misti Traya', 'Michael Welch', 'Ylfa Edelstein', 'Patricia Kalember', 'Peter McRobbie', 'Clark Middleton', 'Scott Sowers', 'Tibor Feldman', 'Patrick Taylor', 'Barry Bostwick']"
8,22,Screwed,"Tue, May 22, 2007","Fin's nephew, Darius, goes to trial and seems determined to take the unit down with him.",8.8,"https://m.media-amazon.com/images/M/MV5BMTY0MzQxMzUzMV5BMl5BanBnXkFtZTgwNjA1Mzg3MjE@._V1_QL75_UX500_CR0,47,500,281_.jpg","['Christopher Meloni', 'Mariska Hargitay', 'Richard Belzer', 'Diane Neal', 'Ice-T', 'BD Wong', 'Tamara Tunie', 'Dann Florek', 'Adam Beach', 'Steven Weber', 'Ludacris', 'Michael Weston', 'Ernest Waddell', 'Jack McGee', 'John Schuck', 'Peter Gerety', 'Isabel Gillies', 'Vincent Spano']"
9,1,Alternate,"Tue, Sep 25, 2007","A woman's child is missing, but her multiple personalities make finding out what happened to the child more difficult. And the case is further complicated by the appearance of a relative.",8.7,"https://m.media-amazon.com/images/M/MV5BMjQwMDQ4Mzg0M15BMl5BanBnXkFtZTgwOTc5ODc3MjE@._V1_QL75_UX500_CR0,47,500,281_.jpg","['Christopher Meloni', 'Mariska Hargitay', 'Richard Belzer', 'Diane Neal', 'Ice-T', 'Adam Beach', 'BD Wong', 'Tamara Tunie', 'Dann Florek', 'Cynthia Nixon', 'Laura Allen', 'Ann Morgan Guilbert', 'Stephen Spinella', 'Joe Grifasi', 'Peter McRobbie', 'Isabel Gillies', 'Bronson Pinchot', 'Quincy Tyler Bernstine']"
9,2,Avatar,"Tue, Oct 2, 2007","A young woman is abducted, and the clues to her disappearance can be found by investigating at her character in an online role-playing game. And her case may also reveal clues about an unsolved case involving another girl's disappearance.",7.5,"https://m.media-amazon.com/images/M/MV5BMzAyOTM2MzMwNl5BMl5BanBnXkFtZTYwNzg0Nzc4._V1_QL75_UX500_CR0,26,500,281_.jpg","['Christopher Meloni', 'Mariska Hargitay', 'Richard Belzer', 'Diane Neal', 'Ice-T', 'Adam Beach', 'BD Wong', 'Tamara Tunie', 'Dann Florek', 'Kevin Tighe', 'Florencia Lozano', 'Richard Short', 'Lisa Joyce', 'Ryan Lynn', 'John Hickok', 'Liza Lapira', 'Anne James', 'Christina Brucato']"
9,3,Impulsive,"Tue, Oct 9, 2007","Benson and Stabler arrest a high school teacher for having sex with one of her students, but the teacher alleges that the student raped her.",8.0,"https://m.media-amazon.com/images/M/MV5BODkwNDY4NjgwMV5BMl5BanBnXkFtZTgwODg5ODc3MjE@._V1_QL75_UX500_CR0,47,500,281_.jpg","['Christopher Meloni', 'Mariska Hargitay', 'Richard Belzer', 'Diane Neal', 'Ice-T', 'Adam Beach', 'BD Wong', 'Tamara Tunie', 'Dann Florek', 'Melissa Joan Hart', 'Kyle Gallner', 'Quincy Dunn-Baker', 'Austin Lysy', 'Elizabeth Keifer', 'Richard Joseph Paul', 'Joanna Merlin', 'Peter McRobbie', 'Joel de la Fuente']"
9,4,Savant,"Tue, Oct 16, 2007","The only witness to a mother's beating is her mentally disabled daughter who is suffering from Williams Syndrome. The husband is an early suspect, but he is protected from prosecution because of the Patriot Act.",8.5,"https://m.media-amazon.com/images/M/MV5BMjAyNjI1NTUzM15BMl5BanBnXkFtZTgwNzY5ODc3MjE@._V1_QL75_UX500_CR0,47,500,281_.jpg","['Christopher Meloni', 'Mariska Hargitay', 'Richard Belzer', 'Diane Neal', 'Ice-T', 'Adam Beach', 'BD Wong', 'Tamara Tunie', 'Dann Florek', 'Aidan Quinn', 'Paulina Gerzon', 'Peter Riegert', 'Julie White', 'Geraldine Hughes', 'Robert Clohessy', 'Joanna Merlin', 'Judy Kuhn', 'Caren Browning']"
9,5,Harm,"Tue, Oct 23, 2007",A New York psychiatrist goes on trial after her torture methods are cited in the death of a former Iraqi prisoner.,7.4,"https://m.media-amazon.com/images/M/MV5BNjQxOTg4MTg5OF5BMl5BanBnXkFtZTgwOTU5ODc3MjE@._V1_QL75_UX500_CR0,47,500,281_.jpg","['Christopher Meloni', 'Mariska Hargitay', 'Richard Belzer', 'Diane Neal', 'Ice-T', 'Adam Beach', 'BD Wong', 'Tamara Tunie', 'Dann Florek', 'Elizabeth McGovern', 'Steven Weber', 'Jennifer Van Dyck', 'Marjan Neshat', 'Jarreth J. Merz', 'Audrie Neenan', 'Libya Pugh', 'Elaine Bromka', 'Elizabeth Morton']"
9,6,Svengali,"Tue, Nov 6, 2007","A grisly murder scene at the bottom of an elevator shaft leads SVU detectives to a group of individuals who are under the spell of a charismatic, imprisoned serial killer.",8.0,"https://m.media-amazon.com/images/M/MV5BMTExNzc1NjM0OTNeQTJeQWpwZ15BbWU4MDA3OTg3NzIx._V1_QL75_UX500_CR0,47,500,281_.jpg","['Christopher Meloni', 'Mariska Hargitay', 'Richard Belzer', 'Diane Neal', 'Ice-T', 'Adam Beach', 'BD Wong', 'Tamara Tunie', 'Dann Florek', 'Jared Harris', 'Shannon Woodward', 'Gareth Saxe', 'Justin Blanchard', 'Zulay Henao', 'Mike Doyle', 'Joel de la Fuente', 'Peter McRobbie', ""Beverly D'Angelo""]"
9,7,Blinded,"Tue, Nov 13, 2007","Stabler suffers temporary blindness after an injury bringing a sexual predator who suffers from schizophrenia into custody. Benson's special interest in the case puts her at odds with ADA Novak, who has a personal agenda of her own.",8.1,"https://m.media-amazon.com/images/M/MV5BMjIxODc0ODc5Ml5BMl5BanBnXkFtZTgwMzU5ODc3MjE@._V1_QL75_UX500_CR0,47,500,281_.jpg","['Christopher Meloni', 'Mariska Hargitay', 'Richard Belzer', 'Diane Neal', 'Ice-T', 'Adam Beach', 'BD Wong', 'Tamara Tunie', 'Dann Florek', 'Arye Gross', 'Isabel Gillies', 'Mike Doyle', 'Peter McRobbie', 'Anne James', 'Sam Waterston', 'John Cullum', 'Heather Braverman', 'Sylvia Kauders']"
9,8,Fight,"Tue, Nov 20, 2007","Two troubled brothers are connected to murder investigation. However, detective Lake suspects that they are trying to put their lives back together, and that they are victims of a setup by a gang leader.",7.7,"https://m.media-amazon.com/images/M/MV5BMTQ1NTYxMzUyMF5BMl5BanBnXkFtZTYwMTk0Nzc4._V1_QL75_UX500_CR0,234,500,281_.jpg","['Christopher Meloni', 'Mariska Hargitay', 'Richard Belzer', 'Diane Neal', 'Ice-T', 'Adam Beach', 'BD Wong', 'Tamara Tunie', 'Dann Florek', 'Gaius Charles', 'Adina Porter', 'Forrest Griffin', 'Lenny Venito', 'Steve Earle', 'Joel de la Fuente', 'Arlen Escarpeta', 'Anwan Glover', 'John Ahlin']"
9,9,Paternity,"Tue, Nov 27, 2007","The discovery of a lost boy leads detectives to a case involving the rape and murder of a nanny, and an automobile accident puts the lives of Stabler's wife and unborn child in jeopardy.",8.6,"https://m.media-amazon.com/images/M/MV5BMjQ0MTc5MjI5OV5BMl5BanBnXkFtZTgwNjY5ODc3MjE@._V1_QL75_UX500_CR0,47,500,281_.jpg","['Christopher Meloni', 'Mariska Hargitay', 'Richard Belzer', 'Diane Neal', 'Ice-T', 'Adam Beach', 'BD Wong', 'Tamara Tunie', 'Dann Florek', 'Mark Valley', 'Anastasia Griffith', 'Tony Cucci', 'Lawrence Saint-Victor', 'Aisha De Haas', 'Steven Bauer', 'Isabel Gillies', 'Matthew Nicklaw', 'Thomas Langston']"
